"No.","Time","Source","Destination","Protocol","Length","Info"
"1","0.000000000","127.0.0.1","127.0.0.1","TCP","74","55150  >  43002 [SYN] Seq=0 Win=43690 Len=0 MSS=65495 SACK_PERM=1 TSval=2804626176 TSecr=0 WS=128"
"2","0.000012711","127.0.0.1","127.0.0.1","TCP","74","43002  >  55150 [SYN, ACK] Seq=0 Ack=1 Win=43690 Len=0 MSS=65495 SACK_PERM=1 TSval=2804626176 TSecr=2804626176 WS=128"
"3","0.000022574","127.0.0.1","127.0.0.1","TCP","66","55150  >  43002 [ACK] Seq=1 Ack=1 Win=43776 Len=0 TSval=2804626176 TSecr=2804626176"
"4","0.000036132","127.0.0.1","127.0.0.1","TCP","106","55150  >  43002 [PSH, ACK] Seq=1 Ack=1 Win=43776 Len=40 TSval=2804626176 TSecr=2804626176"
"5","0.000048826","127.0.0.1","127.0.0.1","TCP","66","43002  >  55150 [ACK] Seq=1 Ack=41 Win=43776 Len=0 TSval=2804626176 TSecr=2804626176"
"6","0.000061507","127.0.0.1","127.0.0.1","TCP","78","43002  >  55150 [PSH, ACK] Seq=1 Ack=41 Win=43776 Len=12 TSval=2804626176 TSecr=2804626176"
"7","0.000068760","127.0.0.1","127.0.0.1","TCP","66","55150  >  43002 [ACK] Seq=41 Ack=13 Win=43776 Len=0 TSval=2804626176 TSecr=2804626176"
"8","0.000090101","127.0.0.1","127.0.0.1","TCP","74","35200  >  42002 [SYN] Seq=0 Win=43690 Len=0 MSS=65495 SACK_PERM=1 TSval=2804626176 TSecr=0 WS=128"
"9","0.000095008","127.0.0.1","127.0.0.1","TCP","74","42002  >  35200 [SYN, ACK] Seq=0 Ack=1 Win=43690 Len=0 MSS=65495 SACK_PERM=1 TSval=2804626176 TSecr=2804626176 WS=128"
"10","0.000099323","127.0.0.1","127.0.0.1","TCP","66","35200  >  42002 [ACK] Seq=1 Ack=1 Win=43776 Len=0 TSval=2804626176 TSecr=2804626176"
"11","0.000107220","127.0.0.1","127.0.0.1","TCP","1066","35200  >  42002 [PSH, ACK] Seq=1 Ack=1 Win=43776 Len=1000 TSval=2804626176 TSecr=2804626176"
"12","0.000110371","127.0.0.1","127.0.0.1","TCP","66","42002  >  35200 [ACK] Seq=1 Ack=1001 Win=45696 Len=0 TSval=2804626176 TSecr=2804626176"
"13","0.000191399","127.0.0.1","127.0.0.1","TCP","91","42002  >  35200 [PSH, ACK] Seq=1 Ack=1001 Win=45696 Len=25 TSval=2804626176 TSecr=2804626176"
"14","0.000199549","127.0.0.1","127.0.0.1","TCP","66","35200  >  42002 [ACK] Seq=1001 Ack=26 Win=43776 Len=0 TSval=2804626176 TSecr=2804626176"
"15","0.000217160","127.0.0.1","127.0.0.1","TCP","74","52760  >  44002 [SYN] Seq=0 Win=43690 Len=0 MSS=65495 SACK_PERM=1 TSval=2804626176 TSecr=0 WS=128"
"16","0.000220968","127.0.0.1","127.0.0.1","TCP","74","44002  >  52760 [SYN, ACK] Seq=0 Ack=1 Win=43690 Len=0 MSS=65495 SACK_PERM=1 TSval=2804626176 TSecr=2804626176 WS=128"
"17","0.000224905","127.0.0.1","127.0.0.1","TCP","66","52760  >  44002 [ACK] Seq=1 Ack=1 Win=43776 Len=0 TSval=2804626176 TSecr=2804626176"
"18","0.000231841","127.0.0.1","127.0.0.1","TCP","1066","52760  >  44002 [PSH, ACK] Seq=1 Ack=1 Win=43776 Len=1000 TSval=2804626176 TSecr=2804626176"
"19","0.000234206","127.0.0.1","127.0.0.1","TCP","66","44002  >  52760 [ACK] Seq=1 Ack=1001 Win=45696 Len=0 TSval=2804626176 TSecr=2804626176"
"20","0.000318004","127.0.0.1","127.0.0.1","TCP","130","44002  >  52760 [PSH, ACK] Seq=1 Ack=1001 Win=45696 Len=64 TSval=2804626176 TSecr=2804626176"
"21","0.000326085","127.0.0.1","127.0.0.1","TCP","66","52760  >  44002 [ACK] Seq=1001 Ack=65 Win=43776 Len=0 TSval=2804626176 TSecr=2804626176"
"22","0.000346481","127.0.0.1","127.0.0.1","TCP","74","55156  >  43002 [SYN] Seq=0 Win=43690 Len=0 MSS=65495 SACK_PERM=1 TSval=2804626176 TSecr=0 WS=128"
"23","0.000350636","127.0.0.1","127.0.0.1","TCP","74","43002  >  55156 [SYN, ACK] Seq=0 Ack=1 Win=43690 Len=0 MSS=65495 SACK_PERM=1 TSval=2804626176 TSecr=2804626176 WS=128"
"24","0.000354758","127.0.0.1","127.0.0.1","TCP","66","55156  >  43002 [ACK] Seq=1 Ack=1 Win=43776 Len=0 TSval=2804626176 TSecr=2804626176"
"25","0.000361898","127.0.0.1","127.0.0.1","TCP","106","55156  >  43002 [PSH, ACK] Seq=1 Ack=1 Win=43776 Len=40 TSval=2804626176 TSecr=2804626176"
"26","0.000369298","127.0.0.1","127.0.0.1","TCP","66","43002  >  55156 [ACK] Seq=1 Ack=41 Win=43776 Len=0 TSval=2804626176 TSecr=2804626176"
"27","0.000376279","127.0.0.1","127.0.0.1","TCP","78","43002  >  55156 [PSH, ACK] Seq=1 Ack=41 Win=43776 Len=12 TSval=2804626176 TSecr=2804626176"
"28","0.000381765","127.0.0.1","127.0.0.1","TCP","66","55156  >  43002 [ACK] Seq=41 Ack=13 Win=43776 Len=0 TSval=2804626176 TSecr=2804626176"
"29","0.000397835","127.0.0.1","127.0.0.1","TCP","74","35206  >  42002 [SYN] Seq=0 Win=43690 Len=0 MSS=65495 SACK_PERM=1 TSval=2804626176 TSecr=0 WS=128"
"30","0.000401462","127.0.0.1","127.0.0.1","TCP","74","42002  >  35206 [SYN, ACK] Seq=0 Ack=1 Win=43690 Len=0 MSS=65495 SACK_PERM=1 TSval=2804626176 TSecr=2804626176 WS=128"
"31","0.000405161","127.0.0.1","127.0.0.1","TCP","66","35206  >  42002 [ACK] Seq=1 Ack=1 Win=43776 Len=0 TSval=2804626176 TSecr=2804626176"
"32","0.000411594","127.0.0.1","127.0.0.1","TCP","1066","35206  >  42002 [PSH, ACK] Seq=1 Ack=1 Win=43776 Len=1000 TSval=2804626176 TSecr=2804626176"
"33","0.000414093","127.0.0.1","127.0.0.1","TCP","66","42002  >  35206 [ACK] Seq=1 Ack=1001 Win=45696 Len=0 TSval=2804626176 TSecr=2804626176"
"34","0.000488865","127.0.0.1","127.0.0.1","TCP","91","42002  >  35206 [PSH, ACK] Seq=1 Ack=1001 Win=45696 Len=25 TSval=2804626176 TSecr=2804626176"
"35","0.000496316","127.0.0.1","127.0.0.1","TCP","66","35206  >  42002 [ACK] Seq=1001 Ack=26 Win=43776 Len=0 TSval=2804626176 TSecr=2804626176"
"36","0.000511898","127.0.0.1","127.0.0.1","TCP","74","52766  >  44002 [SYN] Seq=0 Win=43690 Len=0 MSS=65495 SACK_PERM=1 TSval=2804626176 TSecr=0 WS=128"
"37","0.000515456","127.0.0.1","127.0.0.1","TCP","74","44002  >  52766 [SYN, ACK] Seq=0 Ack=1 Win=43690 Len=0 MSS=65495 SACK_PERM=1 TSval=2804626176 TSecr=2804626176 WS=128"
"38","0.000519077","127.0.0.1","127.0.0.1","TCP","66","52766  >  44002 [ACK] Seq=1 Ack=1 Win=43776 Len=0 TSval=2804626176 TSecr=2804626176"
"39","0.000525640","127.0.0.1","127.0.0.1","TCP","1066","52766  >  44002 [PSH, ACK] Seq=1 Ack=1 Win=43776 Len=1000 TSval=2804626176 TSecr=2804626176"
"40","0.000527995","127.0.0.1","127.0.0.1","TCP","66","44002  >  52766 [ACK] Seq=1 Ack=1001 Win=45696 Len=0 TSval=2804626176 TSecr=2804626176"
"41","0.000598875","127.0.0.1","127.0.0.1","TCP","130","44002  >  52766 [PSH, ACK] Seq=1 Ack=1001 Win=45696 Len=64 TSval=2804626176 TSecr=2804626176"
"42","0.000604857","127.0.0.1","127.0.0.1","TCP","66","52766  >  44002 [ACK] Seq=1001 Ack=65 Win=43776 Len=0 TSval=2804626176 TSecr=2804626176"
"43","0.000620413","127.0.0.1","127.0.0.1","TCP","74","55162  >  43002 [SYN] Seq=0 Win=43690 Len=0 MSS=65495 SACK_PERM=1 TSval=2804626176 TSecr=0 WS=128"
"44","0.000623827","127.0.0.1","127.0.0.1","TCP","74","43002  >  55162 [SYN, ACK] Seq=0 Ack=1 Win=43690 Len=0 MSS=65495 SACK_PERM=1 TSval=2804626176 TSecr=2804626176 WS=128"
"45","0.000627593","127.0.0.1","127.0.0.1","TCP","66","55162  >  43002 [ACK] Seq=1 Ack=1 Win=43776 Len=0 TSval=2804626176 TSecr=2804626176"
"46","0.000634350","127.0.0.1","127.0.0.1","TCP","106","55162  >  43002 [PSH, ACK] Seq=1 Ack=1 Win=43776 Len=40 TSval=2804626176 TSecr=2804626176"
"47","0.000640235","127.0.0.1","127.0.0.1","TCP","66","43002  >  55162 [ACK] Seq=1 Ack=41 Win=43776 Len=0 TSval=2804626176 TSecr=2804626176"
"48","0.000645760","127.0.0.1","127.0.0.1","TCP","78","43002  >  55162 [PSH, ACK] Seq=1 Ack=41 Win=43776 Len=12 TSval=2804626176 TSecr=2804626176"
"49","0.000650863","127.0.0.1","127.0.0.1","TCP","66","55162  >  43002 [ACK] Seq=41 Ack=13 Win=43776 Len=0 TSval=2804626176 TSecr=2804626176"
"50","0.000666619","127.0.0.1","127.0.0.1","TCP","74","35212  >  42002 [SYN] Seq=0 Win=43690 Len=0 MSS=65495 SACK_PERM=1 TSval=2804626176 TSecr=0 WS=128"
"51","0.000670408","127.0.0.1","127.0.0.1","TCP","74","42002  >  35212 [SYN, ACK] Seq=0 Ack=1 Win=43690 Len=0 MSS=65495 SACK_PERM=1 TSval=2804626176 TSecr=2804626176 WS=128"
"52","0.000674335","127.0.0.1","127.0.0.1","TCP","66","35212  >  42002 [ACK] Seq=1 Ack=1 Win=43776 Len=0 TSval=2804626176 TSecr=2804626176"
"53","0.000681477","127.0.0.1","127.0.0.1","TCP","1066","35212  >  42002 [PSH, ACK] Seq=1 Ack=1 Win=43776 Len=1000 TSval=2804626176 TSecr=2804626176"
"54","0.000683958","127.0.0.1","127.0.0.1","TCP","66","42002  >  35212 [ACK] Seq=1 Ack=1001 Win=45696 Len=0 TSval=2804626176 TSecr=2804626176"
"55","0.000745742","127.0.0.1","127.0.0.1","TCP","91","42002  >  35212 [PSH, ACK] Seq=1 Ack=1001 Win=45696 Len=25 TSval=2804626176 TSecr=2804626176"
"56","0.000754019","127.0.0.1","127.0.0.1","TCP","66","35212  >  42002 [ACK] Seq=1001 Ack=26 Win=43776 Len=0 TSval=2804626176 TSecr=2804626176"
"57","0.000769697","127.0.0.1","127.0.0.1","TCP","74","52772  >  44002 [SYN] Seq=0 Win=43690 Len=0 MSS=65495 SACK_PERM=1 TSval=2804626176 TSecr=0 WS=128"
"58","0.000773227","127.0.0.1","127.0.0.1","TCP","74","44002  >  52772 [SYN, ACK] Seq=0 Ack=1 Win=43690 Len=0 MSS=65495 SACK_PERM=1 TSval=2804626176 TSecr=2804626176 WS=128"
"59","0.000776887","127.0.0.1","127.0.0.1","TCP","66","52772  >  44002 [ACK] Seq=1 Ack=1 Win=43776 Len=0 TSval=2804626176 TSecr=2804626176"
"60","0.000784575","127.0.0.1","127.0.0.1","TCP","1066","52772  >  44002 [PSH, ACK] Seq=1 Ack=1 Win=43776 Len=1000 TSval=2804626176 TSecr=2804626176"
"61","0.000787944","127.0.0.1","127.0.0.1","TCP","66","44002  >  52772 [ACK] Seq=1 Ack=1001 Win=45696 Len=0 TSval=2804626176 TSecr=2804626176"
"62","0.000854753","127.0.0.1","127.0.0.1","TCP","130","44002  >  52772 [PSH, ACK] Seq=1 Ack=1001 Win=45696 Len=64 TSval=2804626176 TSecr=2804626176"
"63","0.000863451","127.0.0.1","127.0.0.1","TCP","66","52772  >  44002 [ACK] Seq=1001 Ack=65 Win=43776 Len=0 TSval=2804626176 TSecr=2804626176"
"64","0.000896264","127.0.0.1","127.0.0.1","TCP","74","55168  >  43002 [SYN] Seq=0 Win=43690 Len=0 MSS=65495 SACK_PERM=1 TSval=2804626176 TSecr=0 WS=128"
"65","0.000900737","127.0.0.1","127.0.0.1","TCP","74","43002  >  55168 [SYN, ACK] Seq=0 Ack=1 Win=43690 Len=0 MSS=65495 SACK_PERM=1 TSval=2804626176 TSecr=2804626176 WS=128"
"66","0.000905200","127.0.0.1","127.0.0.1","TCP","66","55168  >  43002 [ACK] Seq=1 Ack=1 Win=43776 Len=0 TSval=2804626176 TSecr=2804626176"
"67","0.000913345","127.0.0.1","127.0.0.1","TCP","106","55168  >  43002 [PSH, ACK] Seq=1 Ack=1 Win=43776 Len=40 TSval=2804626176 TSecr=2804626176"
"68","0.000919113","127.0.0.1","127.0.0.1","TCP","66","43002  >  55168 [ACK] Seq=1 Ack=41 Win=43776 Len=0 TSval=2804626176 TSecr=2804626176"
"69","0.000924053","127.0.0.1","127.0.0.1","TCP","78","43002  >  55168 [PSH, ACK] Seq=1 Ack=41 Win=43776 Len=12 TSval=2804626176 TSecr=2804626176"
"70","0.000929698","127.0.0.1","127.0.0.1","TCP","66","55168  >  43002 [ACK] Seq=41 Ack=13 Win=43776 Len=0 TSval=2804626176 TSecr=2804626176"
"71","0.000947576","127.0.0.1","127.0.0.1","TCP","74","35218  >  42002 [SYN] Seq=0 Win=43690 Len=0 MSS=65495 SACK_PERM=1 TSval=2804626176 TSecr=0 WS=128"
"72","0.000951474","127.0.0.1","127.0.0.1","TCP","74","42002  >  35218 [SYN, ACK] Seq=0 Ack=1 Win=43690 Len=0 MSS=65495 SACK_PERM=1 TSval=2804626176 TSecr=2804626176 WS=128"
"73","0.000955746","127.0.0.1","127.0.0.1","TCP","66","35218  >  42002 [ACK] Seq=1 Ack=1 Win=43776 Len=0 TSval=2804626176 TSecr=2804626176"
"74","0.000963482","127.0.0.1","127.0.0.1","TCP","1066","35218  >  42002 [PSH, ACK] Seq=1 Ack=1 Win=43776 Len=1000 TSval=2804626176 TSecr=2804626176"
"75","0.000966157","127.0.0.1","127.0.0.1","TCP","66","42002  >  35218 [ACK] Seq=1 Ack=1001 Win=45696 Len=0 TSval=2804626176 TSecr=2804626176"
"76","0.001045736","127.0.0.1","127.0.0.1","TCP","91","42002  >  35218 [PSH, ACK] Seq=1 Ack=1001 Win=45696 Len=25 TSval=2804626176 TSecr=2804626176"
"77","0.001052330","127.0.0.1","127.0.0.1","TCP","66","35218  >  42002 [ACK] Seq=1001 Ack=26 Win=43776 Len=0 TSval=2804626176 TSecr=2804626176"
"78","0.001069734","127.0.0.1","127.0.0.1","TCP","74","52778  >  44002 [SYN] Seq=0 Win=43690 Len=0 MSS=65495 SACK_PERM=1 TSval=2804626176 TSecr=0 WS=128"
"79","0.001073790","127.0.0.1","127.0.0.1","TCP","74","44002  >  52778 [SYN, ACK] Seq=0 Ack=1 Win=43690 Len=0 MSS=65495 SACK_PERM=1 TSval=2804626176 TSecr=2804626176 WS=128"
"80","0.001078221","127.0.0.1","127.0.0.1","TCP","66","52778  >  44002 [ACK] Seq=1 Ack=1 Win=43776 Len=0 TSval=2804626176 TSecr=2804626176"
"81","0.001085863","127.0.0.1","127.0.0.1","TCP","1066","52778  >  44002 [PSH, ACK] Seq=1 Ack=1 Win=43776 Len=1000 TSval=2804626176 TSecr=2804626176"
"82","0.001088456","127.0.0.1","127.0.0.1","TCP","66","44002  >  52778 [ACK] Seq=1 Ack=1001 Win=45696 Len=0 TSval=2804626176 TSecr=2804626176"
"83","0.001168550","127.0.0.1","127.0.0.1","TCP","130","44002  >  52778 [PSH, ACK] Seq=1 Ack=1001 Win=45696 Len=64 TSval=2804626176 TSecr=2804626176"
"84","0.001175180","127.0.0.1","127.0.0.1","TCP","66","52778  >  44002 [ACK] Seq=1001 Ack=65 Win=43776 Len=0 TSval=2804626176 TSecr=2804626176"
"85","2.526494459","127.0.0.1","127.0.0.1","TCP","74","55174  >  43002 [SYN] Seq=0 Win=43690 Len=0 MSS=65495 SACK_PERM=1 TSval=2804626934 TSecr=0 WS=128"
"86","2.526537334","127.0.0.1","127.0.0.1","TCP","74","43002  >  55174 [SYN, ACK] Seq=0 Ack=1 Win=43690 Len=0 MSS=65495 SACK_PERM=1 TSval=2804626934 TSecr=2804626934 WS=128"
"87","2.526563900","127.0.0.1","127.0.0.1","TCP","66","55174  >  43002 [ACK] Seq=1 Ack=1 Win=43776 Len=0 TSval=2804626934 TSecr=2804626934"
"88","2.526601484","127.0.0.1","127.0.0.1","TCP","106","55174  >  43002 [PSH, ACK] Seq=1 Ack=1 Win=43776 Len=40 TSval=2804626934 TSecr=2804626934"
"89","2.526644077","127.0.0.1","127.0.0.1","TCP","66","43002  >  55174 [ACK] Seq=1 Ack=41 Win=43776 Len=0 TSval=2804626934 TSecr=2804626934"
"90","2.526679778","127.0.0.1","127.0.0.1","TCP","78","43002  >  55174 [PSH, ACK] Seq=1 Ack=41 Win=43776 Len=12 TSval=2804626934 TSecr=2804626934"
"91","2.526702428","127.0.0.1","127.0.0.1","TCP","66","55174  >  43002 [ACK] Seq=41 Ack=13 Win=43776 Len=0 TSval=2804626934 TSecr=2804626934"
"92","2.526774306","127.0.0.1","127.0.0.1","TCP","74","35224  >  42002 [SYN] Seq=0 Win=43690 Len=0 MSS=65495 SACK_PERM=1 TSval=2804626934 TSecr=0 WS=128"
"93","2.526788568","127.0.0.1","127.0.0.1","TCP","74","42002  >  35224 [SYN, ACK] Seq=0 Ack=1 Win=43690 Len=0 MSS=65495 SACK_PERM=1 TSval=2804626934 TSecr=2804626934 WS=128"
"94","2.526803144","127.0.0.1","127.0.0.1","TCP","66","35224  >  42002 [ACK] Seq=1 Ack=1 Win=43776 Len=0 TSval=2804626934 TSecr=2804626934"
"95","2.526827667","127.0.0.1","127.0.0.1","TCP","1066","35224  >  42002 [PSH, ACK] Seq=1 Ack=1 Win=43776 Len=1000 TSval=2804626934 TSecr=2804626934"
"96","2.526837241","127.0.0.1","127.0.0.1","TCP","66","42002  >  35224 [ACK] Seq=1 Ack=1001 Win=45696 Len=0 TSval=2804626934 TSecr=2804626934"
"97","2.527105264","127.0.0.1","127.0.0.1","TCP","91","42002  >  35224 [PSH, ACK] Seq=1 Ack=1001 Win=45696 Len=25 TSval=2804626934 TSecr=2804626934"
"98","2.527131020","127.0.0.1","127.0.0.1","TCP","66","35224  >  42002 [ACK] Seq=1001 Ack=26 Win=43776 Len=0 TSval=2804626934 TSecr=2804626934"
"99","2.527185254","127.0.0.1","127.0.0.1","TCP","74","52784  >  44002 [SYN] Seq=0 Win=43690 Len=0 MSS=65495 SACK_PERM=1 TSval=2804626934 TSecr=0 WS=128"
"100","2.527196898","127.0.0.1","127.0.0.1","TCP","74","44002  >  52784 [SYN, ACK] Seq=0 Ack=1 Win=43690 Len=0 MSS=65495 SACK_PERM=1 TSval=2804626934 TSecr=2804626934 WS=128"
"101","2.527209325","127.0.0.1","127.0.0.1","TCP","66","52784  >  44002 [ACK] Seq=1 Ack=1 Win=43776 Len=0 TSval=2804626934 TSecr=2804626934"
"102","2.527232869","127.0.0.1","127.0.0.1","TCP","1066","52784  >  44002 [PSH, ACK] Seq=1 Ack=1 Win=43776 Len=1000 TSval=2804626934 TSecr=2804626934"
"103","2.527240580","127.0.0.1","127.0.0.1","TCP","66","44002  >  52784 [ACK] Seq=1 Ack=1001 Win=45696 Len=0 TSval=2804626934 TSecr=2804626934"
"104","2.527439489","127.0.0.1","127.0.0.1","TCP","130","44002  >  52784 [PSH, ACK] Seq=1 Ack=1001 Win=45696 Len=64 TSval=2804626934 TSecr=2804626934"
"105","2.527464300","127.0.0.1","127.0.0.1","TCP","66","52784  >  44002 [ACK] Seq=1001 Ack=65 Win=43776 Len=0 TSval=2804626934 TSecr=2804626934"
"106","2.527526930","127.0.0.1","127.0.0.1","TCP","74","55180  >  43002 [SYN] Seq=0 Win=43690 Len=0 MSS=65495 SACK_PERM=1 TSval=2804626934 TSecr=0 WS=128"
"107","2.527539823","127.0.0.1","127.0.0.1","TCP","74","43002  >  55180 [SYN, ACK] Seq=0 Ack=1 Win=43690 Len=0 MSS=65495 SACK_PERM=1 TSval=2804626934 TSecr=2804626934 WS=128"
"108","2.527552876","127.0.0.1","127.0.0.1","TCP","66","55180  >  43002 [ACK] Seq=1 Ack=1 Win=43776 Len=0 TSval=2804626934 TSecr=2804626934"
"109","2.527576170","127.0.0.1","127.0.0.1","TCP","106","55180  >  43002 [PSH, ACK] Seq=1 Ack=1 Win=43776 Len=40 TSval=2804626934 TSecr=2804626934"
"110","2.527598998","127.0.0.1","127.0.0.1","TCP","66","43002  >  55180 [ACK] Seq=1 Ack=41 Win=43776 Len=0 TSval=2804626934 TSecr=2804626934"
"111","2.527619676","127.0.0.1","127.0.0.1","TCP","78","43002  >  55180 [PSH, ACK] Seq=1 Ack=41 Win=43776 Len=12 TSval=2804626934 TSecr=2804626934"
"112","2.527637394","127.0.0.1","127.0.0.1","TCP","66","55180  >  43002 [ACK] Seq=41 Ack=13 Win=43776 Len=0 TSval=2804626934 TSecr=2804626934"
"113","2.527688320","127.0.0.1","127.0.0.1","TCP","74","35230  >  42002 [SYN] Seq=0 Win=43690 Len=0 MSS=65495 SACK_PERM=1 TSval=2804626934 TSecr=0 WS=128"
"114","2.527699667","127.0.0.1","127.0.0.1","TCP","74","42002  >  35230 [SYN, ACK] Seq=0 Ack=1 Win=43690 Len=0 MSS=65495 SACK_PERM=1 TSval=2804626934 TSecr=2804626934 WS=128"
"115","2.527711566","127.0.0.1","127.0.0.1","TCP","66","35230  >  42002 [ACK] Seq=1 Ack=1 Win=43776 Len=0 TSval=2804626934 TSecr=2804626934"
"116","2.527733482","127.0.0.1","127.0.0.1","TCP","1066","35230  >  42002 [PSH, ACK] Seq=1 Ack=1 Win=43776 Len=1000 TSval=2804626934 TSecr=2804626934"
"117","2.527741538","127.0.0.1","127.0.0.1","TCP","66","42002  >  35230 [ACK] Seq=1 Ack=1001 Win=45696 Len=0 TSval=2804626934 TSecr=2804626934"
"118","2.527977619","127.0.0.1","127.0.0.1","TCP","91","42002  >  35230 [PSH, ACK] Seq=1 Ack=1001 Win=45696 Len=25 TSval=2804626934 TSecr=2804626934"
"119","2.527999040","127.0.0.1","127.0.0.1","TCP","66","35230  >  42002 [ACK] Seq=1001 Ack=26 Win=43776 Len=0 TSval=2804626934 TSecr=2804626934"
"120","2.528052129","127.0.0.1","127.0.0.1","TCP","74","52790  >  44002 [SYN] Seq=0 Win=43690 Len=0 MSS=65495 SACK_PERM=1 TSval=2804626934 TSecr=0 WS=128"
"121","2.528063259","127.0.0.1","127.0.0.1","TCP","74","44002  >  52790 [SYN, ACK] Seq=0 Ack=1 Win=43690 Len=0 MSS=65495 SACK_PERM=1 TSval=2804626934 TSecr=2804626934 WS=128"
"122","2.528075442","127.0.0.1","127.0.0.1","TCP","66","52790  >  44002 [ACK] Seq=1 Ack=1 Win=43776 Len=0 TSval=2804626934 TSecr=2804626934"
"123","2.528096823","127.0.0.1","127.0.0.1","TCP","1066","52790  >  44002 [PSH, ACK] Seq=1 Ack=1 Win=43776 Len=1000 TSval=2804626934 TSecr=2804626934"
"124","2.528104191","127.0.0.1","127.0.0.1","TCP","66","44002  >  52790 [ACK] Seq=1 Ack=1001 Win=45696 Len=0 TSval=2804626934 TSecr=2804626934"
"125","2.528343596","127.0.0.1","127.0.0.1","TCP","130","44002  >  52790 [PSH, ACK] Seq=1 Ack=1001 Win=45696 Len=64 TSval=2804626934 TSecr=2804626934"
"126","2.528367835","127.0.0.1","127.0.0.1","TCP","66","52790  >  44002 [ACK] Seq=1001 Ack=65 Win=43776 Len=0 TSval=2804626934 TSecr=2804626934"
"127","2.528418338","127.0.0.1","127.0.0.1","TCP","74","55186  >  43002 [SYN] Seq=0 Win=43690 Len=0 MSS=65495 SACK_PERM=1 TSval=2804626934 TSecr=0 WS=128"
"128","2.528430725","127.0.0.1","127.0.0.1","TCP","74","43002  >  55186 [SYN, ACK] Seq=0 Ack=1 Win=43690 Len=0 MSS=65495 SACK_PERM=1 TSval=2804626934 TSecr=2804626934 WS=128"
"129","2.528442488","127.0.0.1","127.0.0.1","TCP","66","55186  >  43002 [ACK] Seq=1 Ack=1 Win=43776 Len=0 TSval=2804626934 TSecr=2804626934"
"130","2.528464040","127.0.0.1","127.0.0.1","TCP","106","55186  >  43002 [PSH, ACK] Seq=1 Ack=1 Win=43776 Len=40 TSval=2804626934 TSecr=2804626934"
"131","2.528487090","127.0.0.1","127.0.0.1","TCP","66","43002  >  55186 [ACK] Seq=1 Ack=41 Win=43776 Len=0 TSval=2804626934 TSecr=2804626934"
"132","2.528504551","127.0.0.1","127.0.0.1","TCP","78","43002  >  55186 [PSH, ACK] Seq=1 Ack=41 Win=43776 Len=12 TSval=2804626934 TSecr=2804626934"
"133","2.528521530","127.0.0.1","127.0.0.1","TCP","66","55186  >  43002 [ACK] Seq=41 Ack=13 Win=43776 Len=0 TSval=2804626934 TSecr=2804626934"
"134","2.528571630","127.0.0.1","127.0.0.1","TCP","74","35236  >  42002 [SYN] Seq=0 Win=43690 Len=0 MSS=65495 SACK_PERM=1 TSval=2804626934 TSecr=0 WS=128"
"135","2.528582912","127.0.0.1","127.0.0.1","TCP","74","42002  >  35236 [SYN, ACK] Seq=0 Ack=1 Win=43690 Len=0 MSS=65495 SACK_PERM=1 TSval=2804626934 TSecr=2804626934 WS=128"
"136","2.528595132","127.0.0.1","127.0.0.1","TCP","66","35236  >  42002 [ACK] Seq=1 Ack=1 Win=43776 Len=0 TSval=2804626934 TSecr=2804626934"
"137","2.528617349","127.0.0.1","127.0.0.1","TCP","1066","35236  >  42002 [PSH, ACK] Seq=1 Ack=1 Win=43776 Len=1000 TSval=2804626934 TSecr=2804626934"
"138","2.528624672","127.0.0.1","127.0.0.1","TCP","66","42002  >  35236 [ACK] Seq=1 Ack=1001 Win=45696 Len=0 TSval=2804626934 TSecr=2804626934"
"139","2.528836452","127.0.0.1","127.0.0.1","TCP","91","42002  >  35236 [PSH, ACK] Seq=1 Ack=1001 Win=45696 Len=25 TSval=2804626934 TSecr=2804626934"
"140","2.528854166","127.0.0.1","127.0.0.1","TCP","66","35236  >  42002 [ACK] Seq=1001 Ack=26 Win=43776 Len=0 TSval=2804626934 TSecr=2804626934"
"141","2.528903869","127.0.0.1","127.0.0.1","TCP","74","52796  >  44002 [SYN] Seq=0 Win=43690 Len=0 MSS=65495 SACK_PERM=1 TSval=2804626934 TSecr=0 WS=128"
"142","2.528914660","127.0.0.1","127.0.0.1","TCP","74","44002  >  52796 [SYN, ACK] Seq=0 Ack=1 Win=43690 Len=0 MSS=65495 SACK_PERM=1 TSval=2804626934 TSecr=2804626934 WS=128"
"143","2.528927333","127.0.0.1","127.0.0.1","TCP","66","52796  >  44002 [ACK] Seq=1 Ack=1 Win=43776 Len=0 TSval=2804626934 TSecr=2804626934"
"144","2.528950190","127.0.0.1","127.0.0.1","TCP","1066","52796  >  44002 [PSH, ACK] Seq=1 Ack=1 Win=43776 Len=1000 TSval=2804626934 TSecr=2804626934"
"145","2.528957821","127.0.0.1","127.0.0.1","TCP","66","44002  >  52796 [ACK] Seq=1 Ack=1001 Win=45696 Len=0 TSval=2804626934 TSecr=2804626934"
"146","2.529201723","127.0.0.1","127.0.0.1","TCP","130","44002  >  52796 [PSH, ACK] Seq=1 Ack=1001 Win=45696 Len=64 TSval=2804626934 TSecr=2804626934"
"147","2.529243944","127.0.0.1","127.0.0.1","TCP","66","52796  >  44002 [ACK] Seq=1001 Ack=65 Win=43776 Len=0 TSval=2804626935 TSecr=2804626934"
"148","2.529309413","127.0.0.1","127.0.0.1","TCP","74","55192  >  43002 [SYN] Seq=0 Win=43690 Len=0 MSS=65495 SACK_PERM=1 TSval=2804626935 TSecr=0 WS=128"
"149","2.529322836","127.0.0.1","127.0.0.1","TCP","74","43002  >  55192 [SYN, ACK] Seq=0 Ack=1 Win=43690 Len=0 MSS=65495 SACK_PERM=1 TSval=2804626935 TSecr=2804626935 WS=128"
"150","2.529336155","127.0.0.1","127.0.0.1","TCP","66","55192  >  43002 [ACK] Seq=1 Ack=1 Win=43776 Len=0 TSval=2804626935 TSecr=2804626935"
"151","2.529360162","127.0.0.1","127.0.0.1","TCP","106","55192  >  43002 [PSH, ACK] Seq=1 Ack=1 Win=43776 Len=40 TSval=2804626935 TSecr=2804626935"
"152","2.529379419","127.0.0.1","127.0.0.1","TCP","66","43002  >  55192 [ACK] Seq=1 Ack=41 Win=43776 Len=0 TSval=2804626935 TSecr=2804626935"
"153","2.529394732","127.0.0.1","127.0.0.1","TCP","78","43002  >  55192 [PSH, ACK] Seq=1 Ack=41 Win=43776 Len=12 TSval=2804626935 TSecr=2804626935"
"154","2.529411440","127.0.0.1","127.0.0.1","TCP","66","55192  >  43002 [ACK] Seq=41 Ack=13 Win=43776 Len=0 TSval=2804626935 TSecr=2804626935"
"155","2.529463313","127.0.0.1","127.0.0.1","TCP","74","35242  >  42002 [SYN] Seq=0 Win=43690 Len=0 MSS=65495 SACK_PERM=1 TSval=2804626935 TSecr=0 WS=128"
"156","2.529475089","127.0.0.1","127.0.0.1","TCP","74","42002  >  35242 [SYN, ACK] Seq=0 Ack=1 Win=43690 Len=0 MSS=65495 SACK_PERM=1 TSval=2804626935 TSecr=2804626935 WS=128"
"157","2.529487255","127.0.0.1","127.0.0.1","TCP","66","35242  >  42002 [ACK] Seq=1 Ack=1 Win=43776 Len=0 TSval=2804626935 TSecr=2804626935"
"158","2.529513688","127.0.0.1","127.0.0.1","TCP","1066","35242  >  42002 [PSH, ACK] Seq=1 Ack=1 Win=43776 Len=1000 TSval=2804626935 TSecr=2804626935"
"159","2.529523615","127.0.0.1","127.0.0.1","TCP","66","42002  >  35242 [ACK] Seq=1 Ack=1001 Win=45696 Len=0 TSval=2804626935 TSecr=2804626935"
"160","2.529793007","127.0.0.1","127.0.0.1","TCP","91","42002  >  35242 [PSH, ACK] Seq=1 Ack=1001 Win=45696 Len=25 TSval=2804626935 TSecr=2804626935"
"161","2.529816454","127.0.0.1","127.0.0.1","TCP","66","35242  >  42002 [ACK] Seq=1001 Ack=26 Win=43776 Len=0 TSval=2804626935 TSecr=2804626935"
"162","2.529888722","127.0.0.1","127.0.0.1","TCP","74","52802  >  44002 [SYN] Seq=0 Win=43690 Len=0 MSS=65495 SACK_PERM=1 TSval=2804626935 TSecr=0 WS=128"
"163","2.529899710","127.0.0.1","127.0.0.1","TCP","74","44002  >  52802 [SYN, ACK] Seq=0 Ack=1 Win=43690 Len=0 MSS=65495 SACK_PERM=1 TSval=2804626935 TSecr=2804626935 WS=128"
"164","2.529913093","127.0.0.1","127.0.0.1","TCP","66","52802  >  44002 [ACK] Seq=1 Ack=1 Win=43776 Len=0 TSval=2804626935 TSecr=2804626935"
"165","2.529934694","127.0.0.1","127.0.0.1","TCP","1066","52802  >  44002 [PSH, ACK] Seq=1 Ack=1 Win=43776 Len=1000 TSval=2804626935 TSecr=2804626935"
"166","2.529941413","127.0.0.1","127.0.0.1","TCP","66","44002  >  52802 [ACK] Seq=1 Ack=1001 Win=45696 Len=0 TSval=2804626935 TSecr=2804626935"
"167","2.530161015","127.0.0.1","127.0.0.1","TCP","130","44002  >  52802 [PSH, ACK] Seq=1 Ack=1001 Win=45696 Len=64 TSval=2804626935 TSecr=2804626935"
"168","2.530182878","127.0.0.1","127.0.0.1","TCP","66","52802  >  44002 [ACK] Seq=1001 Ack=65 Win=43776 Len=0 TSval=2804626935 TSecr=2804626935"
"169","3.035484758","127.0.0.1","127.0.0.1","TCP","74","55198  >  43002 [SYN] Seq=0 Win=43690 Len=0 MSS=65495 SACK_PERM=1 TSval=2804627086 TSecr=0 WS=128"
"170","3.035510807","127.0.0.1","127.0.0.1","TCP","74","43002  >  55198 [SYN, ACK] Seq=0 Ack=1 Win=43690 Len=0 MSS=65495 SACK_PERM=1 TSval=2804627086 TSecr=2804627086 WS=128"
"171","3.035535072","127.0.0.1","127.0.0.1","TCP","66","55198  >  43002 [ACK] Seq=1 Ack=1 Win=43776 Len=0 TSval=2804627086 TSecr=2804627086"
"172","3.035568748","127.0.0.1","127.0.0.1","TCP","106","55198  >  43002 [PSH, ACK] Seq=1 Ack=1 Win=43776 Len=40 TSval=2804627086 TSecr=2804627086"
"173","3.035600130","127.0.0.1","127.0.0.1","TCP","66","43002  >  55198 [ACK] Seq=1 Ack=41 Win=43776 Len=0 TSval=2804627086 TSecr=2804627086"
"174","3.035630153","127.0.0.1","127.0.0.1","TCP","78","43002  >  55198 [PSH, ACK] Seq=1 Ack=41 Win=43776 Len=12 TSval=2804627086 TSecr=2804627086"
"175","3.035648209","127.0.0.1","127.0.0.1","TCP","66","55198  >  43002 [ACK] Seq=41 Ack=13 Win=43776 Len=0 TSval=2804627086 TSecr=2804627086"
"176","3.035708482","127.0.0.1","127.0.0.1","TCP","74","35248  >  42002 [SYN] Seq=0 Win=43690 Len=0 MSS=65495 SACK_PERM=1 TSval=2804627086 TSecr=0 WS=128"
"177","3.035721930","127.0.0.1","127.0.0.1","TCP","74","42002  >  35248 [SYN, ACK] Seq=0 Ack=1 Win=43690 Len=0 MSS=65495 SACK_PERM=1 TSval=2804627086 TSecr=2804627086 WS=128"
"178","3.035734922","127.0.0.1","127.0.0.1","TCP","66","35248  >  42002 [ACK] Seq=1 Ack=1 Win=43776 Len=0 TSval=2804627086 TSecr=2804627086"
"179","3.035757730","127.0.0.1","127.0.0.1","TCP","1066","35248  >  42002 [PSH, ACK] Seq=1 Ack=1 Win=43776 Len=1000 TSval=2804627086 TSecr=2804627086"
"180","3.035766219","127.0.0.1","127.0.0.1","TCP","66","42002  >  35248 [ACK] Seq=1 Ack=1001 Win=45696 Len=0 TSval=2804627086 TSecr=2804627086"
"181","3.036058038","127.0.0.1","127.0.0.1","TCP","91","42002  >  35248 [PSH, ACK] Seq=1 Ack=1001 Win=45696 Len=25 TSval=2804627087 TSecr=2804627086"
"182","3.036083101","127.0.0.1","127.0.0.1","TCP","66","35248  >  42002 [ACK] Seq=1001 Ack=26 Win=43776 Len=0 TSval=2804627087 TSecr=2804627087"
"183","3.036137622","127.0.0.1","127.0.0.1","TCP","74","52808  >  44002 [SYN] Seq=0 Win=43690 Len=0 MSS=65495 SACK_PERM=1 TSval=2804627087 TSecr=0 WS=128"
"184","3.036149156","127.0.0.1","127.0.0.1","TCP","74","44002  >  52808 [SYN, ACK] Seq=0 Ack=1 Win=43690 Len=0 MSS=65495 SACK_PERM=1 TSval=2804627087 TSecr=2804627087 WS=128"
"185","3.036161159","127.0.0.1","127.0.0.1","TCP","66","52808  >  44002 [ACK] Seq=1 Ack=1 Win=43776 Len=0 TSval=2804627087 TSecr=2804627087"
"186","3.036182581","127.0.0.1","127.0.0.1","TCP","1066","52808  >  44002 [PSH, ACK] Seq=1 Ack=1 Win=43776 Len=1000 TSval=2804627087 TSecr=2804627087"
"187","3.036189679","127.0.0.1","127.0.0.1","TCP","66","44002  >  52808 [ACK] Seq=1 Ack=1001 Win=45696 Len=0 TSval=2804627087 TSecr=2804627087"
"188","3.036378249","127.0.0.1","127.0.0.1","TCP","130","44002  >  52808 [PSH, ACK] Seq=1 Ack=1001 Win=45696 Len=64 TSval=2804627087 TSecr=2804627087"
"189","3.036396354","127.0.0.1","127.0.0.1","TCP","66","52808  >  44002 [ACK] Seq=1001 Ack=65 Win=43776 Len=0 TSval=2804627087 TSecr=2804627087"
"190","3.036443728","127.0.0.1","127.0.0.1","TCP","74","55204  >  43002 [SYN] Seq=0 Win=43690 Len=0 MSS=65495 SACK_PERM=1 TSval=2804627087 TSecr=0 WS=128"
"191","3.036454306","127.0.0.1","127.0.0.1","TCP","74","43002  >  55204 [SYN, ACK] Seq=0 Ack=1 Win=43690 Len=0 MSS=65495 SACK_PERM=1 TSval=2804627087 TSecr=2804627087 WS=128"
"192","3.036465264","127.0.0.1","127.0.0.1","TCP","66","55204  >  43002 [ACK] Seq=1 Ack=1 Win=43776 Len=0 TSval=2804627087 TSecr=2804627087"
"193","3.036485610","127.0.0.1","127.0.0.1","TCP","106","55204  >  43002 [PSH, ACK] Seq=1 Ack=1 Win=43776 Len=40 TSval=2804627087 TSecr=2804627087"
"194","3.036507523","127.0.0.1","127.0.0.1","TCP","66","43002  >  55204 [ACK] Seq=1 Ack=41 Win=43776 Len=0 TSval=2804627087 TSecr=2804627087"
"195","3.036530379","127.0.0.1","127.0.0.1","TCP","78","43002  >  55204 [PSH, ACK] Seq=1 Ack=41 Win=43776 Len=12 TSval=2804627087 TSecr=2804627087"
"196","3.036546003","127.0.0.1","127.0.0.1","TCP","66","55204  >  43002 [ACK] Seq=41 Ack=13 Win=43776 Len=0 TSval=2804627087 TSecr=2804627087"
"197","3.036592016","127.0.0.1","127.0.0.1","TCP","74","35254  >  42002 [SYN] Seq=0 Win=43690 Len=0 MSS=65495 SACK_PERM=1 TSval=2804627087 TSecr=0 WS=128"
"198","3.036603131","127.0.0.1","127.0.0.1","TCP","74","42002  >  35254 [SYN, ACK] Seq=0 Ack=1 Win=43690 Len=0 MSS=65495 SACK_PERM=1 TSval=2804627087 TSecr=2804627087 WS=128"
"199","3.036614010","127.0.0.1","127.0.0.1","TCP","66","35254  >  42002 [ACK] Seq=1 Ack=1 Win=43776 Len=0 TSval=2804627087 TSecr=2804627087"
"200","3.036634757","127.0.0.1","127.0.0.1","TCP","1066","35254  >  42002 [PSH, ACK] Seq=1 Ack=1 Win=43776 Len=1000 TSval=2804627087 TSecr=2804627087"
"201","3.036642030","127.0.0.1","127.0.0.1","TCP","66","42002  >  35254 [ACK] Seq=1 Ack=1001 Win=45696 Len=0 TSval=2804627087 TSecr=2804627087"
"202","3.036814241","127.0.0.1","127.0.0.1","TCP","91","42002  >  35254 [PSH, ACK] Seq=1 Ack=1001 Win=45696 Len=25 TSval=2804627087 TSecr=2804627087"
"203","3.036833432","127.0.0.1","127.0.0.1","TCP","66","35254  >  42002 [ACK] Seq=1001 Ack=26 Win=43776 Len=0 TSval=2804627087 TSecr=2804627087"
"204","3.036879259","127.0.0.1","127.0.0.1","TCP","74","52814  >  44002 [SYN] Seq=0 Win=43690 Len=0 MSS=65495 SACK_PERM=1 TSval=2804627087 TSecr=0 WS=128"
"205","3.036889387","127.0.0.1","127.0.0.1","TCP","74","44002  >  52814 [SYN, ACK] Seq=0 Ack=1 Win=43690 Len=0 MSS=65495 SACK_PERM=1 TSval=2804627087 TSecr=2804627087 WS=128"
"206","3.036900069","127.0.0.1","127.0.0.1","TCP","66","52814  >  44002 [ACK] Seq=1 Ack=1 Win=43776 Len=0 TSval=2804627087 TSecr=2804627087"
"207","3.036920160","127.0.0.1","127.0.0.1","TCP","1066","52814  >  44002 [PSH, ACK] Seq=1 Ack=1 Win=43776 Len=1000 TSval=2804627087 TSecr=2804627087"
"208","3.036926720","127.0.0.1","127.0.0.1","TCP","66","44002  >  52814 [ACK] Seq=1 Ack=1001 Win=45696 Len=0 TSval=2804627087 TSecr=2804627087"
"209","3.037111241","127.0.0.1","127.0.0.1","TCP","130","44002  >  52814 [PSH, ACK] Seq=1 Ack=1001 Win=45696 Len=64 TSval=2804627087 TSecr=2804627087"
"210","3.037133502","127.0.0.1","127.0.0.1","TCP","66","52814  >  44002 [ACK] Seq=1001 Ack=65 Win=43776 Len=0 TSval=2804627087 TSecr=2804627087"
"211","3.037190160","127.0.0.1","127.0.0.1","TCP","74","55210  >  43002 [SYN] Seq=0 Win=43690 Len=0 MSS=65495 SACK_PERM=1 TSval=2804627087 TSecr=0 WS=128"
"212","3.037201349","127.0.0.1","127.0.0.1","TCP","74","43002  >  55210 [SYN, ACK] Seq=0 Ack=1 Win=43690 Len=0 MSS=65495 SACK_PERM=1 TSval=2804627087 TSecr=2804627087 WS=128"
"213","3.037212730","127.0.0.1","127.0.0.1","TCP","66","55210  >  43002 [ACK] Seq=1 Ack=1 Win=43776 Len=0 TSval=2804627087 TSecr=2804627087"
"214","3.037233423","127.0.0.1","127.0.0.1","TCP","106","55210  >  43002 [PSH, ACK] Seq=1 Ack=1 Win=43776 Len=40 TSval=2804627087 TSecr=2804627087"
"215","3.037253732","127.0.0.1","127.0.0.1","TCP","66","43002  >  55210 [ACK] Seq=1 Ack=41 Win=43776 Len=0 TSval=2804627087 TSecr=2804627087"
"216","3.037274330","127.0.0.1","127.0.0.1","TCP","78","43002  >  55210 [PSH, ACK] Seq=1 Ack=41 Win=43776 Len=12 TSval=2804627087 TSecr=2804627087"
"217","3.037289753","127.0.0.1","127.0.0.1","TCP","66","55210  >  43002 [ACK] Seq=41 Ack=13 Win=43776 Len=0 TSval=2804627087 TSecr=2804627087"
"218","3.037334011","127.0.0.1","127.0.0.1","TCP","74","35260  >  42002 [SYN] Seq=0 Win=43690 Len=0 MSS=65495 SACK_PERM=1 TSval=2804627087 TSecr=0 WS=128"
"219","3.037344495","127.0.0.1","127.0.0.1","TCP","74","42002  >  35260 [SYN, ACK] Seq=0 Ack=1 Win=43690 Len=0 MSS=65495 SACK_PERM=1 TSval=2804627087 TSecr=2804627087 WS=128"
"220","3.037356680","127.0.0.1","127.0.0.1","TCP","66","35260  >  42002 [ACK] Seq=1 Ack=1 Win=43776 Len=0 TSval=2804627087 TSecr=2804627087"
"221","3.037376933","127.0.0.1","127.0.0.1","TCP","1066","35260  >  42002 [PSH, ACK] Seq=1 Ack=1 Win=43776 Len=1000 TSval=2804627087 TSecr=2804627087"
"222","3.037383789","127.0.0.1","127.0.0.1","TCP","66","42002  >  35260 [ACK] Seq=1 Ack=1001 Win=45696 Len=0 TSval=2804627087 TSecr=2804627087"
"223","3.037580009","127.0.0.1","127.0.0.1","TCP","91","42002  >  35260 [PSH, ACK] Seq=1 Ack=1001 Win=45696 Len=25 TSval=2804627087 TSecr=2804627087"
"224","3.037599396","127.0.0.1","127.0.0.1","TCP","66","35260  >  42002 [ACK] Seq=1001 Ack=26 Win=43776 Len=0 TSval=2804627087 TSecr=2804627087"
"225","3.037683378","127.0.0.1","127.0.0.1","TCP","74","52820  >  44002 [SYN] Seq=0 Win=43690 Len=0 MSS=65495 SACK_PERM=1 TSval=2804627087 TSecr=0 WS=128"
"226","3.037699902","127.0.0.1","127.0.0.1","TCP","74","44002  >  52820 [SYN, ACK] Seq=0 Ack=1 Win=43690 Len=0 MSS=65495 SACK_PERM=1 TSval=2804627087 TSecr=2804627087 WS=128"
"227","3.037716181","127.0.0.1","127.0.0.1","TCP","66","52820  >  44002 [ACK] Seq=1 Ack=1 Win=43776 Len=0 TSval=2804627087 TSecr=2804627087"
"228","3.037741835","127.0.0.1","127.0.0.1","TCP","1066","52820  >  44002 [PSH, ACK] Seq=1 Ack=1 Win=43776 Len=1000 TSval=2804627087 TSecr=2804627087"
"229","3.037750410","127.0.0.1","127.0.0.1","TCP","66","44002  >  52820 [ACK] Seq=1 Ack=1001 Win=45696 Len=0 TSval=2804627087 TSecr=2804627087"
"230","3.037934749","127.0.0.1","127.0.0.1","TCP","130","44002  >  52820 [PSH, ACK] Seq=1 Ack=1001 Win=45696 Len=64 TSval=2804627087 TSecr=2804627087"
"231","3.037962193","127.0.0.1","127.0.0.1","TCP","66","52820  >  44002 [ACK] Seq=1001 Ack=65 Win=43776 Len=0 TSval=2804627087 TSecr=2804627087"
"232","3.038051592","127.0.0.1","127.0.0.1","TCP","74","55216  >  43002 [SYN] Seq=0 Win=43690 Len=0 MSS=65495 SACK_PERM=1 TSval=2804627087 TSecr=0 WS=128"
"233","3.038068726","127.0.0.1","127.0.0.1","TCP","74","43002  >  55216 [SYN, ACK] Seq=0 Ack=1 Win=43690 Len=0 MSS=65495 SACK_PERM=1 TSval=2804627087 TSecr=2804627087 WS=128"
"234","3.038085616","127.0.0.1","127.0.0.1","TCP","66","55216  >  43002 [ACK] Seq=1 Ack=1 Win=43776 Len=0 TSval=2804627087 TSecr=2804627087"
"235","3.038113387","127.0.0.1","127.0.0.1","TCP","106","55216  >  43002 [PSH, ACK] Seq=1 Ack=1 Win=43776 Len=40 TSval=2804627087 TSecr=2804627087"
"236","3.038130068","127.0.0.1","127.0.0.1","TCP","66","43002  >  55216 [ACK] Seq=1 Ack=41 Win=43776 Len=0 TSval=2804627087 TSecr=2804627087"
"237","3.038147191","127.0.0.1","127.0.0.1","TCP","78","43002  >  55216 [PSH, ACK] Seq=1 Ack=41 Win=43776 Len=12 TSval=2804627087 TSecr=2804627087"
"238","3.038163239","127.0.0.1","127.0.0.1","TCP","66","55216  >  43002 [ACK] Seq=41 Ack=13 Win=43776 Len=0 TSval=2804627087 TSecr=2804627087"
"239","3.038217707","127.0.0.1","127.0.0.1","TCP","74","35266  >  42002 [SYN] Seq=0 Win=43690 Len=0 MSS=65495 SACK_PERM=1 TSval=2804627087 TSecr=0 WS=128"
"240","3.038229867","127.0.0.1","127.0.0.1","TCP","74","42002  >  35266 [SYN, ACK] Seq=0 Ack=1 Win=43690 Len=0 MSS=65495 SACK_PERM=1 TSval=2804627087 TSecr=2804627087 WS=128"
"241","3.038241888","127.0.0.1","127.0.0.1","TCP","66","35266  >  42002 [ACK] Seq=1 Ack=1 Win=43776 Len=0 TSval=2804627087 TSecr=2804627087"
"242","3.038263139","127.0.0.1","127.0.0.1","TCP","1066","35266  >  42002 [PSH, ACK] Seq=1 Ack=1 Win=43776 Len=1000 TSval=2804627087 TSecr=2804627087"
"243","3.038271276","127.0.0.1","127.0.0.1","TCP","66","42002  >  35266 [ACK] Seq=1 Ack=1001 Win=45696 Len=0 TSval=2804627087 TSecr=2804627087"
"244","3.038508045","127.0.0.1","127.0.0.1","TCP","91","42002  >  35266 [PSH, ACK] Seq=1 Ack=1001 Win=45696 Len=25 TSval=2804627087 TSecr=2804627087"
"245","3.038529866","127.0.0.1","127.0.0.1","TCP","66","35266  >  42002 [ACK] Seq=1001 Ack=26 Win=43776 Len=0 TSval=2804627087 TSecr=2804627087"
"246","3.038586663","127.0.0.1","127.0.0.1","TCP","74","52826  >  44002 [SYN] Seq=0 Win=43690 Len=0 MSS=65495 SACK_PERM=1 TSval=2804627087 TSecr=0 WS=128"
"247","3.038598084","127.0.0.1","127.0.0.1","TCP","74","44002  >  52826 [SYN, ACK] Seq=0 Ack=1 Win=43690 Len=0 MSS=65495 SACK_PERM=1 TSval=2804627087 TSecr=2804627087 WS=128"
"248","3.038609733","127.0.0.1","127.0.0.1","TCP","66","52826  >  44002 [ACK] Seq=1 Ack=1 Win=43776 Len=0 TSval=2804627087 TSecr=2804627087"
"249","3.038631620","127.0.0.1","127.0.0.1","TCP","1066","52826  >  44002 [PSH, ACK] Seq=1 Ack=1 Win=43776 Len=1000 TSval=2804627087 TSecr=2804627087"
"250","3.038638867","127.0.0.1","127.0.0.1","TCP","66","44002  >  52826 [ACK] Seq=1 Ack=1001 Win=45696 Len=0 TSval=2804627087 TSecr=2804627087"
"251","3.038818733","127.0.0.1","127.0.0.1","TCP","130","44002  >  52826 [PSH, ACK] Seq=1 Ack=1001 Win=45696 Len=64 TSval=2804627087 TSecr=2804627087"
"252","3.038838030","127.0.0.1","127.0.0.1","TCP","66","52826  >  44002 [ACK] Seq=1001 Ack=65 Win=43776 Len=0 TSval=2804627087 TSecr=2804627087"
"253","5.059404629","127.0.0.1","127.0.0.1","TCP","74","55222  >  43002 [SYN] Seq=0 Win=43690 Len=0 MSS=65495 SACK_PERM=1 TSval=2804627694 TSecr=0 WS=128"
"254","5.059433920","127.0.0.1","127.0.0.1","TCP","74","43002  >  55222 [SYN, ACK] Seq=0 Ack=1 Win=43690 Len=0 MSS=65495 SACK_PERM=1 TSval=2804627694 TSecr=2804627694 WS=128"
"255","5.059459768","127.0.0.1","127.0.0.1","TCP","66","55222  >  43002 [ACK] Seq=1 Ack=1 Win=43776 Len=0 TSval=2804627694 TSecr=2804627694"
"256","5.059511471","127.0.0.1","127.0.0.1","TCP","106","55222  >  43002 [PSH, ACK] Seq=1 Ack=1 Win=43776 Len=40 TSval=2804627694 TSecr=2804627694"
"257","5.059549722","127.0.0.1","127.0.0.1","TCP","66","43002  >  55222 [ACK] Seq=1 Ack=41 Win=43776 Len=0 TSval=2804627694 TSecr=2804627694"
"258","5.059583292","127.0.0.1","127.0.0.1","TCP","78","43002  >  55222 [PSH, ACK] Seq=1 Ack=41 Win=43776 Len=12 TSval=2804627694 TSecr=2804627694"
"259","5.059603728","127.0.0.1","127.0.0.1","TCP","66","55222  >  43002 [ACK] Seq=41 Ack=13 Win=43776 Len=0 TSval=2804627694 TSecr=2804627694"
"260","5.059687527","127.0.0.1","127.0.0.1","TCP","74","35272  >  42002 [SYN] Seq=0 Win=43690 Len=0 MSS=65495 SACK_PERM=1 TSval=2804627694 TSecr=0 WS=128"
"261","5.059716563","127.0.0.1","127.0.0.1","TCP","74","42002  >  35272 [SYN, ACK] Seq=0 Ack=1 Win=43690 Len=0 MSS=65495 SACK_PERM=1 TSval=2804627694 TSecr=2804627694 WS=128"
"262","5.059732054","127.0.0.1","127.0.0.1","TCP","66","35272  >  42002 [ACK] Seq=1 Ack=1 Win=43776 Len=0 TSval=2804627694 TSecr=2804627694"
"263","5.059760711","127.0.0.1","127.0.0.1","TCP","1066","35272  >  42002 [PSH, ACK] Seq=1 Ack=1 Win=43776 Len=1000 TSval=2804627694 TSecr=2804627694"
"264","5.059770950","127.0.0.1","127.0.0.1","TCP","66","42002  >  35272 [ACK] Seq=1 Ack=1001 Win=45696 Len=0 TSval=2804627694 TSecr=2804627694"
