"No.","Protocol","Length","Time","Source","Info","Destination"
"1","TCP","74","0.000000000","127.0.0.1","51016  >  43003 [SYN] Seq=0 Win=43690 Len=0 MSS=65495 SACK_PERM=1 TSval=2804846344 TSecr=0 WS=128","127.0.0.1"
"2","TCP","74","0.000011481","127.0.0.1","43003  >  51016 [SYN, ACK] Seq=0 Ack=1 Win=43690 Len=0 MSS=65495 SACK_PERM=1 TSval=2804846344 TSecr=2804846344 WS=128","127.0.0.1"
"3","TCP","66","0.000021262","127.0.0.1","51016  >  43003 [ACK] Seq=1 Ack=1 Win=43776 Len=0 TSval=2804846344 TSecr=2804846344","127.0.0.1"
"4","TCP","106","0.000034597","127.0.0.1","51016  >  43003 [PSH, ACK] Seq=1 Ack=1 Win=43776 Len=40 TSval=2804846344 TSecr=2804846344","127.0.0.1"
"5","TCP","66","0.000047008","127.0.0.1","43003  >  51016 [ACK] Seq=1 Ack=41 Win=43776 Len=0 TSval=2804846344 TSecr=2804846344","127.0.0.1"
"6","TCP","78","0.000059062","127.0.0.1","43003  >  51016 [PSH, ACK] Seq=1 Ack=41 Win=43776 Len=12 TSval=2804846344 TSecr=2804846344","127.0.0.1"
"7","TCP","66","0.000066216","127.0.0.1","51016  >  43003 [ACK] Seq=41 Ack=13 Win=43776 Len=0 TSval=2804846344 TSecr=2804846344","127.0.0.1"
"8","TCP","74","0.000086760","127.0.0.1","48684  >  42003 [SYN] Seq=0 Win=43690 Len=0 MSS=65495 SACK_PERM=1 TSval=2804846344 TSecr=0 WS=128","127.0.0.1"
"9","TCP","74","0.000091080","127.0.0.1","42003  >  48684 [SYN, ACK] Seq=0 Ack=1 Win=43690 Len=0 MSS=65495 SACK_PERM=1 TSval=2804846344 TSecr=2804846344 WS=128","127.0.0.1"
"10","TCP","66","0.000095157","127.0.0.1","48684  >  42003 [ACK] Seq=1 Ack=1 Win=43776 Len=0 TSval=2804846344 TSecr=2804846344","127.0.0.1"
"11","TCP","1066","0.000102906","127.0.0.1","48684  >  42003 [PSH, ACK] Seq=1 Ack=1 Win=43776 Len=1000 TSval=2804846344 TSecr=2804846344","127.0.0.1"
"12","TCP","66","0.000105840","127.0.0.1","42003  >  48684 [ACK] Seq=1 Ack=1001 Win=45696 Len=0 TSval=2804846344 TSecr=2804846344","127.0.0.1"
"13","TCP","91","0.000197915","127.0.0.1","42003  >  48684 [PSH, ACK] Seq=1 Ack=1001 Win=45696 Len=25 TSval=2804846344 TSecr=2804846344","127.0.0.1"
"14","TCP","66","0.000206332","127.0.0.1","48684  >  42003 [ACK] Seq=1001 Ack=26 Win=43776 Len=0 TSval=2804846344 TSecr=2804846344","127.0.0.1"
"15","TCP","74","0.000222931","127.0.0.1","59680  >  44003 [SYN] Seq=0 Win=43690 Len=0 MSS=65495 SACK_PERM=1 TSval=2804846344 TSecr=0 WS=128","127.0.0.1"
"16","TCP","74","0.000226637","127.0.0.1","44003  >  59680 [SYN, ACK] Seq=0 Ack=1 Win=43690 Len=0 MSS=65495 SACK_PERM=1 TSval=2804846344 TSecr=2804846344 WS=128","127.0.0.1"
"17","TCP","66","0.000230486","127.0.0.1","59680  >  44003 [ACK] Seq=1 Ack=1 Win=43776 Len=0 TSval=2804846344 TSecr=2804846344","127.0.0.1"
"18","TCP","1066","0.000237151","127.0.0.1","59680  >  44003 [PSH, ACK] Seq=1 Ack=1 Win=43776 Len=1000 TSval=2804846344 TSecr=2804846344","127.0.0.1"
"19","TCP","66","0.000239453","127.0.0.1","44003  >  59680 [ACK] Seq=1 Ack=1001 Win=45696 Len=0 TSval=2804846344 TSecr=2804846344","127.0.0.1"
"20","TCP","130","0.000333741","127.0.0.1","44003  >  59680 [PSH, ACK] Seq=1 Ack=1001 Win=45696 Len=64 TSval=2804846345 TSecr=2804846344","127.0.0.1"
"21","TCP","66","0.000341668","127.0.0.1","59680  >  44003 [ACK] Seq=1001 Ack=65 Win=43776 Len=0 TSval=2804846345 TSecr=2804846345","127.0.0.1"
"22","TCP","74","0.000358877","127.0.0.1","51022  >  43003 [SYN] Seq=0 Win=43690 Len=0 MSS=65495 SACK_PERM=1 TSval=2804846345 TSecr=0 WS=128","127.0.0.1"
"23","TCP","74","0.000362455","127.0.0.1","43003  >  51022 [SYN, ACK] Seq=0 Ack=1 Win=43690 Len=0 MSS=65495 SACK_PERM=1 TSval=2804846345 TSecr=2804846345 WS=128","127.0.0.1"
"24","TCP","66","0.000366118","127.0.0.1","51022  >  43003 [ACK] Seq=1 Ack=1 Win=43776 Len=0 TSval=2804846345 TSecr=2804846345","127.0.0.1"
"25","TCP","106","0.000372908","127.0.0.1","51022  >  43003 [PSH, ACK] Seq=1 Ack=1 Win=43776 Len=40 TSval=2804846345 TSecr=2804846345","127.0.0.1"
"26","TCP","66","0.000378840","127.0.0.1","43003  >  51022 [ACK] Seq=1 Ack=41 Win=43776 Len=0 TSval=2804846345 TSecr=2804846345","127.0.0.1"
"27","TCP","78","0.000384552","127.0.0.1","43003  >  51022 [PSH, ACK] Seq=1 Ack=41 Win=43776 Len=12 TSval=2804846345 TSecr=2804846345","127.0.0.1"
"28","TCP","66","0.000389964","127.0.0.1","51022  >  43003 [ACK] Seq=41 Ack=13 Win=43776 Len=0 TSval=2804846345 TSecr=2804846345","127.0.0.1"
"29","TCP","74","0.000405267","127.0.0.1","48690  >  42003 [SYN] Seq=0 Win=43690 Len=0 MSS=65495 SACK_PERM=1 TSval=2804846345 TSecr=0 WS=128","127.0.0.1"
"30","TCP","74","0.000408738","127.0.0.1","42003  >  48690 [SYN, ACK] Seq=0 Ack=1 Win=43690 Len=0 MSS=65495 SACK_PERM=1 TSval=2804846345 TSecr=2804846345 WS=128","127.0.0.1"
"31","TCP","66","0.000412363","127.0.0.1","48690  >  42003 [ACK] Seq=1 Ack=1 Win=43776 Len=0 TSval=2804846345 TSecr=2804846345","127.0.0.1"
"32","TCP","1066","0.000418899","127.0.0.1","48690  >  42003 [PSH, ACK] Seq=1 Ack=1 Win=43776 Len=1000 TSval=2804846345 TSecr=2804846345","127.0.0.1"
"33","TCP","66","0.000421074","127.0.0.1","42003  >  48690 [ACK] Seq=1 Ack=1001 Win=45696 Len=0 TSval=2804846345 TSecr=2804846345","127.0.0.1"
"34","TCP","91","0.000497265","127.0.0.1","42003  >  48690 [PSH, ACK] Seq=1 Ack=1001 Win=45696 Len=25 TSval=2804846345 TSecr=2804846345","127.0.0.1"
"35","TCP","66","0.000503360","127.0.0.1","48690  >  42003 [ACK] Seq=1001 Ack=26 Win=43776 Len=0 TSval=2804846345 TSecr=2804846345","127.0.0.1"
"36","TCP","74","0.000518098","127.0.0.1","59686  >  44003 [SYN] Seq=0 Win=43690 Len=0 MSS=65495 SACK_PERM=1 TSval=2804846345 TSecr=0 WS=128","127.0.0.1"
"37","TCP","74","0.000521634","127.0.0.1","44003  >  59686 [SYN, ACK] Seq=0 Ack=1 Win=43690 Len=0 MSS=65495 SACK_PERM=1 TSval=2804846345 TSecr=2804846345 WS=128","127.0.0.1"
"38","TCP","66","0.000525226","127.0.0.1","59686  >  44003 [ACK] Seq=1 Ack=1 Win=43776 Len=0 TSval=2804846345 TSecr=2804846345","127.0.0.1"
"39","TCP","1066","0.000531721","127.0.0.1","59686  >  44003 [PSH, ACK] Seq=1 Ack=1 Win=43776 Len=1000 TSval=2804846345 TSecr=2804846345","127.0.0.1"
"40","TCP","66","0.000533836","127.0.0.1","44003  >  59686 [ACK] Seq=1 Ack=1001 Win=45696 Len=0 TSval=2804846345 TSecr=2804846345","127.0.0.1"
"41","TCP","130","0.000626088","127.0.0.1","44003  >  59686 [PSH, ACK] Seq=1 Ack=1001 Win=45696 Len=64 TSval=2804846345 TSecr=2804846345","127.0.0.1"
"42","TCP","66","0.000634171","127.0.0.1","59686  >  44003 [ACK] Seq=1001 Ack=65 Win=43776 Len=0 TSval=2804846345 TSecr=2804846345","127.0.0.1"
"43","TCP","74","0.000653494","127.0.0.1","51028  >  43003 [SYN] Seq=0 Win=43690 Len=0 MSS=65495 SACK_PERM=1 TSval=2804846345 TSecr=0 WS=128","127.0.0.1"
"44","TCP","74","0.000657199","127.0.0.1","43003  >  51028 [SYN, ACK] Seq=0 Ack=1 Win=43690 Len=0 MSS=65495 SACK_PERM=1 TSval=2804846345 TSecr=2804846345 WS=128","127.0.0.1"
"45","TCP","66","0.000661289","127.0.0.1","51028  >  43003 [ACK] Seq=1 Ack=1 Win=43776 Len=0 TSval=2804846345 TSecr=2804846345","127.0.0.1"
"46","TCP","106","0.000668354","127.0.0.1","51028  >  43003 [PSH, ACK] Seq=1 Ack=1 Win=43776 Len=40 TSval=2804846345 TSecr=2804846345","127.0.0.1"
"47","TCP","66","0.000673681","127.0.0.1","43003  >  51028 [ACK] Seq=1 Ack=41 Win=43776 Len=0 TSval=2804846345 TSecr=2804846345","127.0.0.1"
"48","TCP","78","0.000677824","127.0.0.1","43003  >  51028 [PSH, ACK] Seq=1 Ack=41 Win=43776 Len=12 TSval=2804846345 TSecr=2804846345","127.0.0.1"
"49","TCP","66","0.000682805","127.0.0.1","51028  >  43003 [ACK] Seq=41 Ack=13 Win=43776 Len=0 TSval=2804846345 TSecr=2804846345","127.0.0.1"
"50","TCP","74","0.000698729","127.0.0.1","48696  >  42003 [SYN] Seq=0 Win=43690 Len=0 MSS=65495 SACK_PERM=1 TSval=2804846345 TSecr=0 WS=128","127.0.0.1"
"51","TCP","74","0.000702417","127.0.0.1","42003  >  48696 [SYN, ACK] Seq=0 Ack=1 Win=43690 Len=0 MSS=65495 SACK_PERM=1 TSval=2804846345 TSecr=2804846345 WS=128","127.0.0.1"
"52","TCP","66","0.000706013","127.0.0.1","48696  >  42003 [ACK] Seq=1 Ack=1 Win=43776 Len=0 TSval=2804846345 TSecr=2804846345","127.0.0.1"
"53","TCP","1066","0.000712421","127.0.0.1","48696  >  42003 [PSH, ACK] Seq=1 Ack=1 Win=43776 Len=1000 TSval=2804846345 TSecr=2804846345","127.0.0.1"
"54","TCP","66","0.000714757","127.0.0.1","42003  >  48696 [ACK] Seq=1 Ack=1001 Win=45696 Len=0 TSval=2804846345 TSecr=2804846345","127.0.0.1"
"55","TCP","91","0.000787124","127.0.0.1","42003  >  48696 [PSH, ACK] Seq=1 Ack=1001 Win=45696 Len=25 TSval=2804846345 TSecr=2804846345","127.0.0.1"
"56","TCP","66","0.000795390","127.0.0.1","48696  >  42003 [ACK] Seq=1001 Ack=26 Win=43776 Len=0 TSval=2804846345 TSecr=2804846345","127.0.0.1"
"57","TCP","74","0.000810645","127.0.0.1","59692  >  44003 [SYN] Seq=0 Win=43690 Len=0 MSS=65495 SACK_PERM=1 TSval=2804846345 TSecr=0 WS=128","127.0.0.1"
"58","TCP","74","0.000814078","127.0.0.1","44003  >  59692 [SYN, ACK] Seq=0 Ack=1 Win=43690 Len=0 MSS=65495 SACK_PERM=1 TSval=2804846345 TSecr=2804846345 WS=128","127.0.0.1"
"59","TCP","66","0.000817690","127.0.0.1","59692  >  44003 [ACK] Seq=1 Ack=1 Win=43776 Len=0 TSval=2804846345 TSecr=2804846345","127.0.0.1"
"60","TCP","1066","0.000823986","127.0.0.1","59692  >  44003 [PSH, ACK] Seq=1 Ack=1 Win=43776 Len=1000 TSval=2804846345 TSecr=2804846345","127.0.0.1"
"61","TCP","66","0.000826283","127.0.0.1","44003  >  59692 [ACK] Seq=1 Ack=1001 Win=45696 Len=0 TSval=2804846345 TSecr=2804846345","127.0.0.1"
"62","TCP","130","0.000883429","127.0.0.1","44003  >  59692 [PSH, ACK] Seq=1 Ack=1001 Win=45696 Len=64 TSval=2804846345 TSecr=2804846345","127.0.0.1"
"63","TCP","66","0.000889653","127.0.0.1","59692  >  44003 [ACK] Seq=1001 Ack=65 Win=43776 Len=0 TSval=2804846345 TSecr=2804846345","127.0.0.1"
"64","TCP","74","0.000904406","127.0.0.1","51034  >  43003 [SYN] Seq=0 Win=43690 Len=0 MSS=65495 SACK_PERM=1 TSval=2804846345 TSecr=0 WS=128","127.0.0.1"
"65","TCP","74","0.000907821","127.0.0.1","43003  >  51034 [SYN, ACK] Seq=0 Ack=1 Win=43690 Len=0 MSS=65495 SACK_PERM=1 TSval=2804846345 TSecr=2804846345 WS=128","127.0.0.1"
"66","TCP","66","0.000911294","127.0.0.1","51034  >  43003 [ACK] Seq=1 Ack=1 Win=43776 Len=0 TSval=2804846345 TSecr=2804846345","127.0.0.1"
"67","TCP","106","0.000917996","127.0.0.1","51034  >  43003 [PSH, ACK] Seq=1 Ack=1 Win=43776 Len=40 TSval=2804846345 TSecr=2804846345","127.0.0.1"
"68","TCP","66","0.000923374","127.0.0.1","43003  >  51034 [ACK] Seq=1 Ack=41 Win=43776 Len=0 TSval=2804846345 TSecr=2804846345","127.0.0.1"
"69","TCP","78","0.000927584","127.0.0.1","43003  >  51034 [PSH, ACK] Seq=1 Ack=41 Win=43776 Len=12 TSval=2804846345 TSecr=2804846345","127.0.0.1"
"70","TCP","66","0.000932611","127.0.0.1","51034  >  43003 [ACK] Seq=41 Ack=13 Win=43776 Len=0 TSval=2804846345 TSecr=2804846345","127.0.0.1"
"71","TCP","74","0.000947298","127.0.0.1","48702  >  42003 [SYN] Seq=0 Win=43690 Len=0 MSS=65495 SACK_PERM=1 TSval=2804846345 TSecr=0 WS=128","127.0.0.1"
"72","TCP","74","0.000951332","127.0.0.1","42003  >  48702 [SYN, ACK] Seq=0 Ack=1 Win=43690 Len=0 MSS=65495 SACK_PERM=1 TSval=2804846345 TSecr=2804846345 WS=128","127.0.0.1"
"73","TCP","66","0.000955071","127.0.0.1","48702  >  42003 [ACK] Seq=1 Ack=1 Win=43776 Len=0 TSval=2804846345 TSecr=2804846345","127.0.0.1"
"74","TCP","1066","0.000961656","127.0.0.1","48702  >  42003 [PSH, ACK] Seq=1 Ack=1 Win=43776 Len=1000 TSval=2804846345 TSecr=2804846345","127.0.0.1"
"75","TCP","66","0.000963856","127.0.0.1","42003  >  48702 [ACK] Seq=1 Ack=1001 Win=45696 Len=0 TSval=2804846345 TSecr=2804846345","127.0.0.1"
"76","TCP","91","0.001034998","127.0.0.1","42003  >  48702 [PSH, ACK] Seq=1 Ack=1001 Win=45696 Len=25 TSval=2804846345 TSecr=2804846345","127.0.0.1"
"77","TCP","66","0.001040709","127.0.0.1","48702  >  42003 [ACK] Seq=1001 Ack=26 Win=43776 Len=0 TSval=2804846345 TSecr=2804846345","127.0.0.1"
"78","TCP","74","0.001056345","127.0.0.1","59698  >  44003 [SYN] Seq=0 Win=43690 Len=0 MSS=65495 SACK_PERM=1 TSval=2804846345 TSecr=0 WS=128","127.0.0.1"
"79","TCP","74","0.001059811","127.0.0.1","44003  >  59698 [SYN, ACK] Seq=0 Ack=1 Win=43690 Len=0 MSS=65495 SACK_PERM=1 TSval=2804846345 TSecr=2804846345 WS=128","127.0.0.1"
"80","TCP","66","0.001063836","127.0.0.1","59698  >  44003 [ACK] Seq=1 Ack=1 Win=43776 Len=0 TSval=2804846345 TSecr=2804846345","127.0.0.1"
"81","TCP","1066","0.001070340","127.0.0.1","59698  >  44003 [PSH, ACK] Seq=1 Ack=1 Win=43776 Len=1000 TSval=2804846345 TSecr=2804846345","127.0.0.1"
"82","TCP","66","0.001072526","127.0.0.1","44003  >  59698 [ACK] Seq=1 Ack=1001 Win=45696 Len=0 TSval=2804846345 TSecr=2804846345","127.0.0.1"
"83","TCP","130","0.001154110","127.0.0.1","44003  >  59698 [PSH, ACK] Seq=1 Ack=1001 Win=45696 Len=64 TSval=2804846345 TSecr=2804846345","127.0.0.1"
"84","TCP","66","0.001160149","127.0.0.1","59698  >  44003 [ACK] Seq=1001 Ack=65 Win=43776 Len=0 TSval=2804846345 TSecr=2804846345","127.0.0.1"
"85","TCP","74","2.507960779","127.0.0.1","51040  >  43003 [SYN] Seq=0 Win=43690 Len=0 MSS=65495 SACK_PERM=1 TSval=2804847097 TSecr=0 WS=128","127.0.0.1"
"86","TCP","74","2.507989633","127.0.0.1","43003  >  51040 [SYN, ACK] Seq=0 Ack=1 Win=43690 Len=0 MSS=65495 SACK_PERM=1 TSval=2804847097 TSecr=2804847097 WS=128","127.0.0.1"
"87","TCP","66","2.508021591","127.0.0.1","51040  >  43003 [ACK] Seq=1 Ack=1 Win=43776 Len=0 TSval=2804847097 TSecr=2804847097","127.0.0.1"
"88","TCP","106","2.508059235","127.0.0.1","51040  >  43003 [PSH, ACK] Seq=1 Ack=1 Win=43776 Len=40 TSval=2804847097 TSecr=2804847097","127.0.0.1"
"89","TCP","66","2.508098626","127.0.0.1","43003  >  51040 [ACK] Seq=1 Ack=41 Win=43776 Len=0 TSval=2804847097 TSecr=2804847097","127.0.0.1"
"90","TCP","78","2.508132429","127.0.0.1","43003  >  51040 [PSH, ACK] Seq=1 Ack=41 Win=43776 Len=12 TSval=2804847097 TSecr=2804847097","127.0.0.1"
"91","TCP","66","2.508154365","127.0.0.1","51040  >  43003 [ACK] Seq=41 Ack=13 Win=43776 Len=0 TSval=2804847097 TSecr=2804847097","127.0.0.1"
"92","TCP","74","2.508223871","127.0.0.1","48708  >  42003 [SYN] Seq=0 Win=43690 Len=0 MSS=65495 SACK_PERM=1 TSval=2804847097 TSecr=0 WS=128","127.0.0.1"
"93","TCP","74","2.508238079","127.0.0.1","42003  >  48708 [SYN, ACK] Seq=0 Ack=1 Win=43690 Len=0 MSS=65495 SACK_PERM=1 TSval=2804847097 TSecr=2804847097 WS=128","127.0.0.1"
"94","TCP","66","2.508252655","127.0.0.1","48708  >  42003 [ACK] Seq=1 Ack=1 Win=43776 Len=0 TSval=2804847097 TSecr=2804847097","127.0.0.1"
"95","TCP","1066","2.508280724","127.0.0.1","48708  >  42003 [PSH, ACK] Seq=1 Ack=1 Win=43776 Len=1000 TSval=2804847097 TSecr=2804847097","127.0.0.1"
"96","TCP","66","2.508293292","127.0.0.1","42003  >  48708 [ACK] Seq=1 Ack=1001 Win=45696 Len=0 TSval=2804847097 TSecr=2804847097","127.0.0.1"
"97","TCP","91","2.508548424","127.0.0.1","42003  >  48708 [PSH, ACK] Seq=1 Ack=1001 Win=45696 Len=25 TSval=2804847097 TSecr=2804847097","127.0.0.1"
"98","TCP","66","2.508571990","127.0.0.1","48708  >  42003 [ACK] Seq=1001 Ack=26 Win=43776 Len=0 TSval=2804847097 TSecr=2804847097","127.0.0.1"
"99","TCP","74","2.508640780","127.0.0.1","59704  >  44003 [SYN] Seq=0 Win=43690 Len=0 MSS=65495 SACK_PERM=1 TSval=2804847097 TSecr=0 WS=128","127.0.0.1"
"100","TCP","74","2.508656321","127.0.0.1","44003  >  59704 [SYN, ACK] Seq=0 Ack=1 Win=43690 Len=0 MSS=65495 SACK_PERM=1 TSval=2804847097 TSecr=2804847097 WS=128","127.0.0.1"
"101","TCP","66","2.508670036","127.0.0.1","59704  >  44003 [ACK] Seq=1 Ack=1 Win=43776 Len=0 TSval=2804847097 TSecr=2804847097","127.0.0.1"
"102","TCP","1066","2.508695402","127.0.0.1","59704  >  44003 [PSH, ACK] Seq=1 Ack=1 Win=43776 Len=1000 TSval=2804847097 TSecr=2804847097","127.0.0.1"
"103","TCP","66","2.508703726","127.0.0.1","44003  >  59704 [ACK] Seq=1 Ack=1001 Win=45696 Len=0 TSval=2804847097 TSecr=2804847097","127.0.0.1"
"104","TCP","130","2.508928578","127.0.0.1","44003  >  59704 [PSH, ACK] Seq=1 Ack=1001 Win=45696 Len=64 TSval=2804847097 TSecr=2804847097","127.0.0.1"
"105","TCP","66","2.508953236","127.0.0.1","59704  >  44003 [ACK] Seq=1001 Ack=65 Win=43776 Len=0 TSval=2804847097 TSecr=2804847097","127.0.0.1"
"106","TCP","74","2.509014953","127.0.0.1","51046  >  43003 [SYN] Seq=0 Win=43690 Len=0 MSS=65495 SACK_PERM=1 TSval=2804847097 TSecr=0 WS=128","127.0.0.1"
"107","TCP","74","2.509027649","127.0.0.1","43003  >  51046 [SYN, ACK] Seq=0 Ack=1 Win=43690 Len=0 MSS=65495 SACK_PERM=1 TSval=2804847097 TSecr=2804847097 WS=128","127.0.0.1"
"108","TCP","66","2.509040972","127.0.0.1","51046  >  43003 [ACK] Seq=1 Ack=1 Win=43776 Len=0 TSval=2804847097 TSecr=2804847097","127.0.0.1"
"109","TCP","106","2.509065281","127.0.0.1","51046  >  43003 [PSH, ACK] Seq=1 Ack=1 Win=43776 Len=40 TSval=2804847097 TSecr=2804847097","127.0.0.1"
"110","TCP","66","2.509086252","127.0.0.1","43003  >  51046 [ACK] Seq=1 Ack=41 Win=43776 Len=0 TSval=2804847097 TSecr=2804847097","127.0.0.1"
"111","TCP","78","2.509101635","127.0.0.1","43003  >  51046 [PSH, ACK] Seq=1 Ack=41 Win=43776 Len=12 TSval=2804847097 TSecr=2804847097","127.0.0.1"
"112","TCP","66","2.509118622","127.0.0.1","51046  >  43003 [ACK] Seq=41 Ack=13 Win=43776 Len=0 TSval=2804847097 TSecr=2804847097","127.0.0.1"
"113","TCP","74","2.509169754","127.0.0.1","48714  >  42003 [SYN] Seq=0 Win=43690 Len=0 MSS=65495 SACK_PERM=1 TSval=2804847097 TSecr=0 WS=128","127.0.0.1"
"114","TCP","74","2.509181203","127.0.0.1","42003  >  48714 [SYN, ACK] Seq=0 Ack=1 Win=43690 Len=0 MSS=65495 SACK_PERM=1 TSval=2804847097 TSecr=2804847097 WS=128","127.0.0.1"
"115","TCP","66","2.509192819","127.0.0.1","48714  >  42003 [ACK] Seq=1 Ack=1 Win=43776 Len=0 TSval=2804847097 TSecr=2804847097","127.0.0.1"
"116","TCP","1066","2.509216534","127.0.0.1","48714  >  42003 [PSH, ACK] Seq=1 Ack=1 Win=43776 Len=1000 TSval=2804847097 TSecr=2804847097","127.0.0.1"
"117","TCP","66","2.509227414","127.0.0.1","42003  >  48714 [ACK] Seq=1 Ack=1001 Win=45696 Len=0 TSval=2804847097 TSecr=2804847097","127.0.0.1"
"118","TCP","91","2.509475224","127.0.0.1","42003  >  48714 [PSH, ACK] Seq=1 Ack=1001 Win=45696 Len=25 TSval=2804847097 TSecr=2804847097","127.0.0.1"
"119","TCP","66","2.509506182","127.0.0.1","48714  >  42003 [ACK] Seq=1001 Ack=26 Win=43776 Len=0 TSval=2804847097 TSecr=2804847097","127.0.0.1"
"120","TCP","74","2.509565715","127.0.0.1","59710  >  44003 [SYN] Seq=0 Win=43690 Len=0 MSS=65495 SACK_PERM=1 TSval=2804847097 TSecr=0 WS=128","127.0.0.1"
"121","TCP","74","2.509577913","127.0.0.1","44003  >  59710 [SYN, ACK] Seq=0 Ack=1 Win=43690 Len=0 MSS=65495 SACK_PERM=1 TSval=2804847097 TSecr=2804847097 WS=128","127.0.0.1"
"122","TCP","66","2.509590620","127.0.0.1","59710  >  44003 [ACK] Seq=1 Ack=1 Win=43776 Len=0 TSval=2804847097 TSecr=2804847097","127.0.0.1"
"123","TCP","1066","2.509613903","127.0.0.1","59710  >  44003 [PSH, ACK] Seq=1 Ack=1 Win=43776 Len=1000 TSval=2804847097 TSecr=2804847097","127.0.0.1"
"124","TCP","66","2.509621199","127.0.0.1","44003  >  59710 [ACK] Seq=1 Ack=1001 Win=45696 Len=0 TSval=2804847097 TSecr=2804847097","127.0.0.1"
"125","TCP","130","2.509854892","127.0.0.1","44003  >  59710 [PSH, ACK] Seq=1 Ack=1001 Win=45696 Len=64 TSval=2804847097 TSecr=2804847097","127.0.0.1"
"126","TCP","66","2.509881070","127.0.0.1","59710  >  44003 [ACK] Seq=1001 Ack=65 Win=43776 Len=0 TSval=2804847097 TSecr=2804847097","127.0.0.1"
"127","TCP","74","2.509935277","127.0.0.1","51052  >  43003 [SYN] Seq=0 Win=43690 Len=0 MSS=65495 SACK_PERM=1 TSval=2804847097 TSecr=0 WS=128","127.0.0.1"
"128","TCP","74","2.509946272","127.0.0.1","43003  >  51052 [SYN, ACK] Seq=0 Ack=1 Win=43690 Len=0 MSS=65495 SACK_PERM=1 TSval=2804847097 TSecr=2804847097 WS=128","127.0.0.1"
"129","TCP","66","2.509957518","127.0.0.1","51052  >  43003 [ACK] Seq=1 Ack=1 Win=43776 Len=0 TSval=2804847097 TSecr=2804847097","127.0.0.1"
"130","TCP","106","2.509978547","127.0.0.1","51052  >  43003 [PSH, ACK] Seq=1 Ack=1 Win=43776 Len=40 TSval=2804847097 TSecr=2804847097","127.0.0.1"
"131","TCP","66","2.509999466","127.0.0.1","43003  >  51052 [ACK] Seq=1 Ack=41 Win=43776 Len=0 TSval=2804847097 TSecr=2804847097","127.0.0.1"
"132","TCP","78","2.510016675","127.0.0.1","43003  >  51052 [PSH, ACK] Seq=1 Ack=41 Win=43776 Len=12 TSval=2804847097 TSecr=2804847097","127.0.0.1"
"133","TCP","66","2.510033490","127.0.0.1","51052  >  43003 [ACK] Seq=41 Ack=13 Win=43776 Len=0 TSval=2804847097 TSecr=2804847097","127.0.0.1"
"134","TCP","74","2.510081772","127.0.0.1","48720  >  42003 [SYN] Seq=0 Win=43690 Len=0 MSS=65495 SACK_PERM=1 TSval=2804847097 TSecr=0 WS=128","127.0.0.1"
"135","TCP","74","2.510092684","127.0.0.1","42003  >  48720 [SYN, ACK] Seq=0 Ack=1 Win=43690 Len=0 MSS=65495 SACK_PERM=1 TSval=2804847097 TSecr=2804847097 WS=128","127.0.0.1"
"136","TCP","66","2.510104113","127.0.0.1","48720  >  42003 [ACK] Seq=1 Ack=1 Win=43776 Len=0 TSval=2804847097 TSecr=2804847097","127.0.0.1"
"137","TCP","1066","2.510124956","127.0.0.1","48720  >  42003 [PSH, ACK] Seq=1 Ack=1 Win=43776 Len=1000 TSval=2804847097 TSecr=2804847097","127.0.0.1"
"138","TCP","66","2.510132544","127.0.0.1","42003  >  48720 [ACK] Seq=1 Ack=1001 Win=45696 Len=0 TSval=2804847097 TSecr=2804847097","127.0.0.1"
"139","TCP","91","2.510410724","127.0.0.1","42003  >  48720 [PSH, ACK] Seq=1 Ack=1001 Win=45696 Len=25 TSval=2804847098 TSecr=2804847097","127.0.0.1"
"140","TCP","66","2.510434620","127.0.0.1","48720  >  42003 [ACK] Seq=1001 Ack=26 Win=43776 Len=0 TSval=2804847098 TSecr=2804847098","127.0.0.1"
"141","TCP","74","2.510490076","127.0.0.1","59716  >  44003 [SYN] Seq=0 Win=43690 Len=0 MSS=65495 SACK_PERM=1 TSval=2804847098 TSecr=0 WS=128","127.0.0.1"
"142","TCP","74","2.510501876","127.0.0.1","44003  >  59716 [SYN, ACK] Seq=0 Ack=1 Win=43690 Len=0 MSS=65495 SACK_PERM=1 TSval=2804847098 TSecr=2804847098 WS=128","127.0.0.1"
"143","TCP","66","2.510513675","127.0.0.1","59716  >  44003 [ACK] Seq=1 Ack=1 Win=43776 Len=0 TSval=2804847098 TSecr=2804847098","127.0.0.1"
"144","TCP","1066","2.510534958","127.0.0.1","59716  >  44003 [PSH, ACK] Seq=1 Ack=1 Win=43776 Len=1000 TSval=2804847098 TSecr=2804847098","127.0.0.1"
"145","TCP","66","2.510542099","127.0.0.1","44003  >  59716 [ACK] Seq=1 Ack=1001 Win=45696 Len=0 TSval=2804847098 TSecr=2804847098","127.0.0.1"
"146","TCP","130","2.510721576","127.0.0.1","44003  >  59716 [PSH, ACK] Seq=1 Ack=1001 Win=45696 Len=64 TSval=2804847098 TSecr=2804847098","127.0.0.1"
"147","TCP","66","2.510739362","127.0.0.1","59716  >  44003 [ACK] Seq=1001 Ack=65 Win=43776 Len=0 TSval=2804847098 TSecr=2804847098","127.0.0.1"
"148","TCP","74","2.510794423","127.0.0.1","51058  >  43003 [SYN] Seq=0 Win=43690 Len=0 MSS=65495 SACK_PERM=1 TSval=2804847098 TSecr=0 WS=128","127.0.0.1"
"149","TCP","74","2.510805453","127.0.0.1","43003  >  51058 [SYN, ACK] Seq=0 Ack=1 Win=43690 Len=0 MSS=65495 SACK_PERM=1 TSval=2804847098 TSecr=2804847098 WS=128","127.0.0.1"
"150","TCP","66","2.510817434","127.0.0.1","51058  >  43003 [ACK] Seq=1 Ack=1 Win=43776 Len=0 TSval=2804847098 TSecr=2804847098","127.0.0.1"
"151","TCP","106","2.510839915","127.0.0.1","51058  >  43003 [PSH, ACK] Seq=1 Ack=1 Win=43776 Len=40 TSval=2804847098 TSecr=2804847098","127.0.0.1"
"152","TCP","66","2.510857685","127.0.0.1","43003  >  51058 [ACK] Seq=1 Ack=41 Win=43776 Len=0 TSval=2804847098 TSecr=2804847098","127.0.0.1"
"153","TCP","78","2.510870460","127.0.0.1","43003  >  51058 [PSH, ACK] Seq=1 Ack=41 Win=43776 Len=12 TSval=2804847098 TSecr=2804847098","127.0.0.1"
"154","TCP","66","2.510886237","127.0.0.1","51058  >  43003 [ACK] Seq=41 Ack=13 Win=43776 Len=0 TSval=2804847098 TSecr=2804847098","127.0.0.1"
"155","TCP","74","2.510935568","127.0.0.1","48726  >  42003 [SYN] Seq=0 Win=43690 Len=0 MSS=65495 SACK_PERM=1 TSval=2804847098 TSecr=0 WS=128","127.0.0.1"
"156","TCP","74","2.510946875","127.0.0.1","42003  >  48726 [SYN, ACK] Seq=0 Ack=1 Win=43690 Len=0 MSS=65495 SACK_PERM=1 TSval=2804847098 TSecr=2804847098 WS=128","127.0.0.1"
"157","TCP","66","2.510958545","127.0.0.1","48726  >  42003 [ACK] Seq=1 Ack=1 Win=43776 Len=0 TSval=2804847098 TSecr=2804847098","127.0.0.1"
"158","TCP","1066","2.510983075","127.0.0.1","48726  >  42003 [PSH, ACK] Seq=1 Ack=1 Win=43776 Len=1000 TSval=2804847098 TSecr=2804847098","127.0.0.1"
"159","TCP","66","2.510993742","127.0.0.1","42003  >  48726 [ACK] Seq=1 Ack=1001 Win=45696 Len=0 TSval=2804847098 TSecr=2804847098","127.0.0.1"
"160","TCP","91","2.511275491","127.0.0.1","42003  >  48726 [PSH, ACK] Seq=1 Ack=1001 Win=45696 Len=25 TSval=2804847098 TSecr=2804847098","127.0.0.1"
"161","TCP","66","2.511302421","127.0.0.1","48726  >  42003 [ACK] Seq=1001 Ack=26 Win=43776 Len=0 TSval=2804847098 TSecr=2804847098","127.0.0.1"
"162","TCP","74","2.511362572","127.0.0.1","59722  >  44003 [SYN] Seq=0 Win=43690 Len=0 MSS=65495 SACK_PERM=1 TSval=2804847098 TSecr=0 WS=128","127.0.0.1"
"163","TCP","74","2.511375006","127.0.0.1","44003  >  59722 [SYN, ACK] Seq=0 Ack=1 Win=43690 Len=0 MSS=65495 SACK_PERM=1 TSval=2804847098 TSecr=2804847098 WS=128","127.0.0.1"
"164","TCP","66","2.511387577","127.0.0.1","59722  >  44003 [ACK] Seq=1 Ack=1 Win=43776 Len=0 TSval=2804847098 TSecr=2804847098","127.0.0.1"
"165","TCP","1066","2.511409779","127.0.0.1","59722  >  44003 [PSH, ACK] Seq=1 Ack=1 Win=43776 Len=1000 TSval=2804847098 TSecr=2804847098","127.0.0.1"
"166","TCP","66","2.511416869","127.0.0.1","44003  >  59722 [ACK] Seq=1 Ack=1001 Win=45696 Len=0 TSval=2804847098 TSecr=2804847098","127.0.0.1"
"167","TCP","130","2.511663539","127.0.0.1","44003  >  59722 [PSH, ACK] Seq=1 Ack=1001 Win=45696 Len=64 TSval=2804847098 TSecr=2804847098","127.0.0.1"
"168","TCP","66","2.511693939","127.0.0.1","59722  >  44003 [ACK] Seq=1001 Ack=65 Win=43776 Len=0 TSval=2804847098 TSecr=2804847098","127.0.0.1"
"169","TCP","74","3.013078687","127.0.0.1","51064  >  43003 [SYN] Seq=0 Win=43690 Len=0 MSS=65495 SACK_PERM=1 TSval=2804847248 TSecr=0 WS=128","127.0.0.1"
"170","TCP","74","3.013092651","127.0.0.1","43003  >  51064 [SYN, ACK] Seq=0 Ack=1 Win=43690 Len=0 MSS=65495 SACK_PERM=1 TSval=2804847248 TSecr=2804847248 WS=128","127.0.0.1"
"171","TCP","66","3.013103216","127.0.0.1","51064  >  43003 [ACK] Seq=1 Ack=1 Win=43776 Len=0 TSval=2804847248 TSecr=2804847248","127.0.0.1"
"172","TCP","106","3.013119985","127.0.0.1","51064  >  43003 [PSH, ACK] Seq=1 Ack=1 Win=43776 Len=40 TSval=2804847248 TSecr=2804847248","127.0.0.1"
"173","TCP","66","3.013124327","127.0.0.1","43003  >  51064 [ACK] Seq=1 Ack=41 Win=43776 Len=0 TSval=2804847248 TSecr=2804847248","127.0.0.1"
"174","TCP","78","3.013134968","127.0.0.1","43003  >  51064 [PSH, ACK] Seq=1 Ack=41 Win=43776 Len=12 TSval=2804847248 TSecr=2804847248","127.0.0.1"
"175","TCP","66","3.013143708","127.0.0.1","51064  >  43003 [ACK] Seq=41 Ack=13 Win=43776 Len=0 TSval=2804847248 TSecr=2804847248","127.0.0.1"
"176","TCP","74","3.013183509","127.0.0.1","48732  >  42003 [SYN] Seq=0 Win=43690 Len=0 MSS=65495 SACK_PERM=1 TSval=2804847248 TSecr=0 WS=128","127.0.0.1"
"177","TCP","74","3.013188568","127.0.0.1","42003  >  48732 [SYN, ACK] Seq=0 Ack=1 Win=43690 Len=0 MSS=65495 SACK_PERM=1 TSval=2804847248 TSecr=2804847248 WS=128","127.0.0.1"
"178","TCP","66","3.013194070","127.0.0.1","48732  >  42003 [ACK] Seq=1 Ack=1 Win=43776 Len=0 TSval=2804847248 TSecr=2804847248","127.0.0.1"
"179","TCP","1066","3.013203470","127.0.0.1","48732  >  42003 [PSH, ACK] Seq=1 Ack=1 Win=43776 Len=1000 TSval=2804847248 TSecr=2804847248","127.0.0.1"
"180","TCP","66","3.013206593","127.0.0.1","42003  >  48732 [ACK] Seq=1 Ack=1001 Win=45696 Len=0 TSval=2804847248 TSecr=2804847248","127.0.0.1"
"181","TCP","91","3.013330021","127.0.0.1","42003  >  48732 [PSH, ACK] Seq=1 Ack=1001 Win=45696 Len=25 TSval=2804847248 TSecr=2804847248","127.0.0.1"
"182","TCP","66","3.013348754","127.0.0.1","48732  >  42003 [ACK] Seq=1001 Ack=26 Win=43776 Len=0 TSval=2804847248 TSecr=2804847248","127.0.0.1"
"183","TCP","74","3.013407678","127.0.0.1","59728  >  44003 [SYN] Seq=0 Win=43690 Len=0 MSS=65495 SACK_PERM=1 TSval=2804847248 TSecr=0 WS=128","127.0.0.1"
"184","TCP","74","3.013415469","127.0.0.1","44003  >  59728 [SYN, ACK] Seq=0 Ack=1 Win=43690 Len=0 MSS=65495 SACK_PERM=1 TSval=2804847248 TSecr=2804847248 WS=128","127.0.0.1"
"185","TCP","66","3.013422773","127.0.0.1","59728  >  44003 [ACK] Seq=1 Ack=1 Win=43776 Len=0 TSval=2804847248 TSecr=2804847248","127.0.0.1"
"186","TCP","1066","3.013435531","127.0.0.1","59728  >  44003 [PSH, ACK] Seq=1 Ack=1 Win=43776 Len=1000 TSval=2804847248 TSecr=2804847248","127.0.0.1"
"187","TCP","66","3.013438986","127.0.0.1","44003  >  59728 [ACK] Seq=1 Ack=1001 Win=45696 Len=0 TSval=2804847248 TSecr=2804847248","127.0.0.1"
"188","TCP","130","3.013536458","127.0.0.1","44003  >  59728 [PSH, ACK] Seq=1 Ack=1001 Win=45696 Len=64 TSval=2804847248 TSecr=2804847248","127.0.0.1"
"189","TCP","66","3.013554404","127.0.0.1","59728  >  44003 [ACK] Seq=1001 Ack=65 Win=43776 Len=0 TSval=2804847248 TSecr=2804847248","127.0.0.1"
"190","TCP","74","3.013602819","127.0.0.1","51070  >  43003 [SYN] Seq=0 Win=43690 Len=0 MSS=65495 SACK_PERM=1 TSval=2804847248 TSecr=0 WS=128","127.0.0.1"
"191","TCP","74","3.013617062","127.0.0.1","43003  >  51070 [SYN, ACK] Seq=0 Ack=1 Win=43690 Len=0 MSS=65495 SACK_PERM=1 TSval=2804847248 TSecr=2804847248 WS=128","127.0.0.1"
"192","TCP","66","3.013624318","127.0.0.1","51070  >  43003 [ACK] Seq=1 Ack=1 Win=43776 Len=0 TSval=2804847248 TSecr=2804847248","127.0.0.1"
"193","TCP","106","3.013637068","127.0.0.1","51070  >  43003 [PSH, ACK] Seq=1 Ack=1 Win=43776 Len=40 TSval=2804847248 TSecr=2804847248","127.0.0.1"
"194","TCP","66","3.013645579","127.0.0.1","43003  >  51070 [ACK] Seq=1 Ack=41 Win=43776 Len=0 TSval=2804847248 TSecr=2804847248","127.0.0.1"
"195","TCP","78","3.013682782","127.0.0.1","43003  >  51070 [PSH, ACK] Seq=1 Ack=41 Win=43776 Len=12 TSval=2804847249 TSecr=2804847248","127.0.0.1"
"196","TCP","66","3.013691498","127.0.0.1","51070  >  43003 [ACK] Seq=41 Ack=13 Win=43776 Len=0 TSval=2804847249 TSecr=2804847249","127.0.0.1"
"197","TCP","74","3.013735692","127.0.0.1","48738  >  42003 [SYN] Seq=0 Win=43690 Len=0 MSS=65495 SACK_PERM=1 TSval=2804847249 TSecr=0 WS=128","127.0.0.1"
"198","TCP","74","3.013741679","127.0.0.1","42003  >  48738 [SYN, ACK] Seq=0 Ack=1 Win=43690 Len=0 MSS=65495 SACK_PERM=1 TSval=2804847249 TSecr=2804847249 WS=128","127.0.0.1"
"199","TCP","66","3.013747424","127.0.0.1","48738  >  42003 [ACK] Seq=1 Ack=1 Win=43776 Len=0 TSval=2804847249 TSecr=2804847249","127.0.0.1"
"200","TCP","1066","3.013758683","127.0.0.1","48738  >  42003 [PSH, ACK] Seq=1 Ack=1 Win=43776 Len=1000 TSval=2804847249 TSecr=2804847249","127.0.0.1"
"201","TCP","66","3.013762408","127.0.0.1","42003  >  48738 [ACK] Seq=1 Ack=1001 Win=45696 Len=0 TSval=2804847249 TSecr=2804847249","127.0.0.1"
"202","TCP","91","3.013890992","127.0.0.1","42003  >  48738 [PSH, ACK] Seq=1 Ack=1001 Win=45696 Len=25 TSval=2804847249 TSecr=2804847249","127.0.0.1"
"203","TCP","66","3.013901514","127.0.0.1","48738  >  42003 [ACK] Seq=1001 Ack=26 Win=43776 Len=0 TSval=2804847249 TSecr=2804847249","127.0.0.1"
"204","TCP","74","3.013924810","127.0.0.1","59734  >  44003 [SYN] Seq=0 Win=43690 Len=0 MSS=65495 SACK_PERM=1 TSval=2804847249 TSecr=0 WS=128","127.0.0.1"
"205","TCP","74","3.013929753","127.0.0.1","44003  >  59734 [SYN, ACK] Seq=0 Ack=1 Win=43690 Len=0 MSS=65495 SACK_PERM=1 TSval=2804847249 TSecr=2804847249 WS=128","127.0.0.1"
"206","TCP","66","3.013935042","127.0.0.1","59734  >  44003 [ACK] Seq=1 Ack=1 Win=43776 Len=0 TSval=2804847249 TSecr=2804847249","127.0.0.1"
"207","TCP","1066","3.013945615","127.0.0.1","59734  >  44003 [PSH, ACK] Seq=1 Ack=1 Win=43776 Len=1000 TSval=2804847249 TSecr=2804847249","127.0.0.1"
"208","TCP","66","3.013948791","127.0.0.1","44003  >  59734 [ACK] Seq=1 Ack=1001 Win=45696 Len=0 TSval=2804847249 TSecr=2804847249","127.0.0.1"
"209","TCP","130","3.014056439","127.0.0.1","44003  >  59734 [PSH, ACK] Seq=1 Ack=1001 Win=45696 Len=64 TSval=2804847249 TSecr=2804847249","127.0.0.1"
"210","TCP","66","3.014071030","127.0.0.1","59734  >  44003 [ACK] Seq=1001 Ack=65 Win=43776 Len=0 TSval=2804847249 TSecr=2804847249","127.0.0.1"
"211","TCP","74","3.014112884","127.0.0.1","51076  >  43003 [SYN] Seq=0 Win=43690 Len=0 MSS=65495 SACK_PERM=1 TSval=2804847249 TSecr=0 WS=128","127.0.0.1"
"212","TCP","74","3.014120068","127.0.0.1","43003  >  51076 [SYN, ACK] Seq=0 Ack=1 Win=43690 Len=0 MSS=65495 SACK_PERM=1 TSval=2804847249 TSecr=2804847249 WS=128","127.0.0.1"
"213","TCP","66","3.014127845","127.0.0.1","51076  >  43003 [ACK] Seq=1 Ack=1 Win=43776 Len=0 TSval=2804847249 TSecr=2804847249","127.0.0.1"
"214","TCP","106","3.014140717","127.0.0.1","51076  >  43003 [PSH, ACK] Seq=1 Ack=1 Win=43776 Len=40 TSval=2804847249 TSecr=2804847249","127.0.0.1"
"215","TCP","66","3.014149414","127.0.0.1","43003  >  51076 [ACK] Seq=1 Ack=41 Win=43776 Len=0 TSval=2804847249 TSecr=2804847249","127.0.0.1"
"216","TCP","78","3.014157419","127.0.0.1","43003  >  51076 [PSH, ACK] Seq=1 Ack=41 Win=43776 Len=12 TSval=2804847249 TSecr=2804847249","127.0.0.1"
"217","TCP","66","3.014165195","127.0.0.1","51076  >  43003 [ACK] Seq=41 Ack=13 Win=43776 Len=0 TSval=2804847249 TSecr=2804847249","127.0.0.1"
"218","TCP","74","3.014189069","127.0.0.1","48744  >  42003 [SYN] Seq=0 Win=43690 Len=0 MSS=65495 SACK_PERM=1 TSval=2804847249 TSecr=0 WS=128","127.0.0.1"
"219","TCP","74","3.014194373","127.0.0.1","42003  >  48744 [SYN, ACK] Seq=0 Ack=1 Win=43690 Len=0 MSS=65495 SACK_PERM=1 TSval=2804847249 TSecr=2804847249 WS=128","127.0.0.1"
"220","TCP","66","3.014199722","127.0.0.1","48744  >  42003 [ACK] Seq=1 Ack=1 Win=43776 Len=0 TSval=2804847249 TSecr=2804847249","127.0.0.1"
"221","TCP","1066","3.014209639","127.0.0.1","48744  >  42003 [PSH, ACK] Seq=1 Ack=1 Win=43776 Len=1000 TSval=2804847249 TSecr=2804847249","127.0.0.1"
"222","TCP","66","3.014213239","127.0.0.1","42003  >  48744 [ACK] Seq=1 Ack=1001 Win=45696 Len=0 TSval=2804847249 TSecr=2804847249","127.0.0.1"
"223","TCP","91","3.014337775","127.0.0.1","42003  >  48744 [PSH, ACK] Seq=1 Ack=1001 Win=45696 Len=25 TSval=2804847249 TSecr=2804847249","127.0.0.1"
"224","TCP","66","3.014348174","127.0.0.1","48744  >  42003 [ACK] Seq=1001 Ack=26 Win=43776 Len=0 TSval=2804847249 TSecr=2804847249","127.0.0.1"
"225","TCP","74","3.014381368","127.0.0.1","59740  >  44003 [SYN] Seq=0 Win=43690 Len=0 MSS=65495 SACK_PERM=1 TSval=2804847249 TSecr=0 WS=128","127.0.0.1"
"226","TCP","74","3.014387892","127.0.0.1","44003  >  59740 [SYN, ACK] Seq=0 Ack=1 Win=43690 Len=0 MSS=65495 SACK_PERM=1 TSval=2804847249 TSecr=2804847249 WS=128","127.0.0.1"
"227","TCP","66","3.014394129","127.0.0.1","59740  >  44003 [ACK] Seq=1 Ack=1 Win=43776 Len=0 TSval=2804847249 TSecr=2804847249","127.0.0.1"
"228","TCP","1066","3.014405204","127.0.0.1","59740  >  44003 [PSH, ACK] Seq=1 Ack=1 Win=43776 Len=1000 TSval=2804847249 TSecr=2804847249","127.0.0.1"
"229","TCP","66","3.014408479","127.0.0.1","44003  >  59740 [ACK] Seq=1 Ack=1001 Win=45696 Len=0 TSval=2804847249 TSecr=2804847249","127.0.0.1"
"230","TCP","130","3.014525976","127.0.0.1","44003  >  59740 [PSH, ACK] Seq=1 Ack=1001 Win=45696 Len=64 TSval=2804847249 TSecr=2804847249","127.0.0.1"
"231","TCP","66","3.014535456","127.0.0.1","59740  >  44003 [ACK] Seq=1001 Ack=65 Win=43776 Len=0 TSval=2804847249 TSecr=2804847249","127.0.0.1"
"232","TCP","74","3.014558455","127.0.0.1","51082  >  43003 [SYN] Seq=0 Win=43690 Len=0 MSS=65495 SACK_PERM=1 TSval=2804847249 TSecr=0 WS=128","127.0.0.1"
"233","TCP","74","3.014563850","127.0.0.1","43003  >  51082 [SYN, ACK] Seq=0 Ack=1 Win=43690 Len=0 MSS=65495 SACK_PERM=1 TSval=2804847249 TSecr=2804847249 WS=128","127.0.0.1"
"234","TCP","66","3.014569211","127.0.0.1","51082  >  43003 [ACK] Seq=1 Ack=1 Win=43776 Len=0 TSval=2804847249 TSecr=2804847249","127.0.0.1"
"235","TCP","106","3.014579066","127.0.0.1","51082  >  43003 [PSH, ACK] Seq=1 Ack=1 Win=43776 Len=40 TSval=2804847249 TSecr=2804847249","127.0.0.1"
"236","TCP","66","3.014582064","127.0.0.1","43003  >  51082 [ACK] Seq=1 Ack=41 Win=43776 Len=0 TSval=2804847249 TSecr=2804847249","127.0.0.1"
"237","TCP","78","3.014589798","127.0.0.1","43003  >  51082 [PSH, ACK] Seq=1 Ack=41 Win=43776 Len=12 TSval=2804847249 TSecr=2804847249","127.0.0.1"
"238","TCP","66","3.014596949","127.0.0.1","51082  >  43003 [ACK] Seq=41 Ack=13 Win=43776 Len=0 TSval=2804847249 TSecr=2804847249","127.0.0.1"
"239","TCP","74","3.014617939","127.0.0.1","48750  >  42003 [SYN] Seq=0 Win=43690 Len=0 MSS=65495 SACK_PERM=1 TSval=2804847249 TSecr=0 WS=128","127.0.0.1"
"240","TCP","74","3.014623338","127.0.0.1","42003  >  48750 [SYN, ACK] Seq=0 Ack=1 Win=43690 Len=0 MSS=65495 SACK_PERM=1 TSval=2804847249 TSecr=2804847249 WS=128","127.0.0.1"
"241","TCP","66","3.014628171","127.0.0.1","48750  >  42003 [ACK] Seq=1 Ack=1 Win=43776 Len=0 TSval=2804847249 TSecr=2804847249","127.0.0.1"
"242","TCP","1066","3.014637594","127.0.0.1","48750  >  42003 [PSH, ACK] Seq=1 Ack=1 Win=43776 Len=1000 TSval=2804847249 TSecr=2804847249","127.0.0.1"
"243","TCP","66","3.014640523","127.0.0.1","42003  >  48750 [ACK] Seq=1 Ack=1001 Win=45696 Len=0 TSval=2804847249 TSecr=2804847249","127.0.0.1"
"244","TCP","91","3.014749823","127.0.0.1","42003  >  48750 [PSH, ACK] Seq=1 Ack=1001 Win=45696 Len=25 TSval=2804847249 TSecr=2804847249","127.0.0.1"
"245","TCP","66","3.014757855","127.0.0.1","48750  >  42003 [ACK] Seq=1001 Ack=26 Win=43776 Len=0 TSval=2804847249 TSecr=2804847249","127.0.0.1"
"246","TCP","74","3.014778837","127.0.0.1","59746  >  44003 [SYN] Seq=0 Win=43690 Len=0 MSS=65495 SACK_PERM=1 TSval=2804847249 TSecr=0 WS=128","127.0.0.1"
"247","TCP","74","3.014783708","127.0.0.1","44003  >  59746 [SYN, ACK] Seq=0 Ack=1 Win=43690 Len=0 MSS=65495 SACK_PERM=1 TSval=2804847249 TSecr=2804847249 WS=128","127.0.0.1"
"248","TCP","66","3.014788344","127.0.0.1","59746  >  44003 [ACK] Seq=1 Ack=1 Win=43776 Len=0 TSval=2804847249 TSecr=2804847249","127.0.0.1"
"249","TCP","1066","3.014799413","127.0.0.1","59746  >  44003 [PSH, ACK] Seq=1 Ack=1 Win=43776 Len=1000 TSval=2804847249 TSecr=2804847249","127.0.0.1"
"250","TCP","66","3.014803419","127.0.0.1","44003  >  59746 [ACK] Seq=1 Ack=1001 Win=45696 Len=0 TSval=2804847249 TSecr=2804847249","127.0.0.1"
"251","TCP","130","3.014938900","127.0.0.1","44003  >  59746 [PSH, ACK] Seq=1 Ack=1001 Win=45696 Len=64 TSval=2804847249 TSecr=2804847249","127.0.0.1"
"252","TCP","66","3.014948572","127.0.0.1","59746  >  44003 [ACK] Seq=1001 Ack=65 Win=43776 Len=0 TSval=2804847249 TSecr=2804847249","127.0.0.1"
"253","TCP","74","5.020988477","127.0.0.1","51088  >  43003 [SYN] Seq=0 Win=43690 Len=0 MSS=65495 SACK_PERM=1 TSval=2804847851 TSecr=0 WS=128","127.0.0.1"
"254","TCP","74","5.021017502","127.0.0.1","43003  >  51088 [SYN, ACK] Seq=0 Ack=1 Win=43690 Len=0 MSS=65495 SACK_PERM=1 TSval=2804847851 TSecr=2804847851 WS=128","127.0.0.1"
"255","TCP","66","5.021041799","127.0.0.1","51088  >  43003 [ACK] Seq=1 Ack=1 Win=43776 Len=0 TSval=2804847851 TSecr=2804847851","127.0.0.1"
"256","TCP","106","5.021076877","127.0.0.1","51088  >  43003 [PSH, ACK] Seq=1 Ack=1 Win=43776 Len=40 TSval=2804847851 TSecr=2804847851","127.0.0.1"
"257","TCP","66","5.021086670","127.0.0.1","43003  >  51088 [ACK] Seq=1 Ack=41 Win=43776 Len=0 TSval=2804847851 TSecr=2804847851","127.0.0.1"
"258","TCP","78","5.021130970","127.0.0.1","43003  >  51088 [PSH, ACK] Seq=1 Ack=41 Win=43776 Len=12 TSval=2804847851 TSecr=2804847851","127.0.0.1"
"259","TCP","66","5.021162605","127.0.0.1","51088  >  43003 [ACK] Seq=41 Ack=13 Win=43776 Len=0 TSval=2804847851 TSecr=2804847851","127.0.0.1"
"260","TCP","74","5.021227441","127.0.0.1","48756  >  42003 [SYN] Seq=0 Win=43690 Len=0 MSS=65495 SACK_PERM=1 TSval=2804847851 TSecr=0 WS=128","127.0.0.1"
"261","TCP","74","5.021241150","127.0.0.1","42003  >  48756 [SYN, ACK] Seq=0 Ack=1 Win=43690 Len=0 MSS=65495 SACK_PERM=1 TSval=2804847851 TSecr=2804847851 WS=128","127.0.0.1"
"262","TCP","66","5.021254729","127.0.0.1","48756  >  42003 [ACK] Seq=1 Ack=1 Win=43776 Len=0 TSval=2804847851 TSecr=2804847851","127.0.0.1"
"263","TCP","1066","5.021280230","127.0.0.1","48756  >  42003 [PSH, ACK] Seq=1 Ack=1 Win=43776 Len=1000 TSval=2804847851 TSecr=2804847851","127.0.0.1"
"264","TCP","66","5.021288960","127.0.0.1","42003  >  48756 [ACK] Seq=1 Ack=1001 Win=45696 Len=0 TSval=2804847851 TSecr=2804847851","127.0.0.1"
