"No.","Protocol","Length","Time","Source","Info","Destination"
"1","TCP","74","0.000000000","127.0.0.1","56972  >  43002 [SYN] Seq=0 Win=43690 Len=0 MSS=65495 SACK_PERM=1 TSval=2804770971 TSecr=0 WS=128","127.0.0.1"
"2","TCP","74","0.000013922","127.0.0.1","43002  >  56972 [SYN, ACK] Seq=0 Ack=1 Win=43690 Len=0 MSS=65495 SACK_PERM=1 TSval=2804770971 TSecr=2804770971 WS=128","127.0.0.1"
"3","TCP","66","0.000024712","127.0.0.1","56972  >  43002 [ACK] Seq=1 Ack=1 Win=43776 Len=0 TSval=2804770971 TSecr=2804770971","127.0.0.1"
"4","TCP","106","0.000040962","127.0.0.1","56972  >  43002 [PSH, ACK] Seq=1 Ack=1 Win=43776 Len=40 TSval=2804770971 TSecr=2804770971","127.0.0.1"
"5","TCP","66","0.000055629","127.0.0.1","43002  >  56972 [ACK] Seq=1 Ack=41 Win=43776 Len=0 TSval=2804770971 TSecr=2804770971","127.0.0.1"
"6","TCP","78","0.000070511","127.0.0.1","43002  >  56972 [PSH, ACK] Seq=1 Ack=41 Win=43776 Len=12 TSval=2804770971 TSecr=2804770971","127.0.0.1"
"7","TCP","66","0.000079579","127.0.0.1","56972  >  43002 [ACK] Seq=41 Ack=13 Win=43776 Len=0 TSval=2804770971 TSecr=2804770971","127.0.0.1"
"8","TCP","74","0.000105791","127.0.0.1","37022  >  42002 [SYN] Seq=0 Win=43690 Len=0 MSS=65495 SACK_PERM=1 TSval=2804770971 TSecr=0 WS=128","127.0.0.1"
"9","TCP","74","0.000111304","127.0.0.1","42002  >  37022 [SYN, ACK] Seq=0 Ack=1 Win=43690 Len=0 MSS=65495 SACK_PERM=1 TSval=2804770971 TSecr=2804770971 WS=128","127.0.0.1"
"10","TCP","66","0.000116783","127.0.0.1","37022  >  42002 [ACK] Seq=1 Ack=1 Win=43776 Len=0 TSval=2804770971 TSecr=2804770971","127.0.0.1"
"11","TCP","1066","0.000126833","127.0.0.1","37022  >  42002 [PSH, ACK] Seq=1 Ack=1 Win=43776 Len=1000 TSval=2804770971 TSecr=2804770971","127.0.0.1"
"12","TCP","66","0.000130428","127.0.0.1","42002  >  37022 [ACK] Seq=1 Ack=1001 Win=45696 Len=0 TSval=2804770971 TSecr=2804770971","127.0.0.1"
"13","TCP","91","0.000238943","127.0.0.1","42002  >  37022 [PSH, ACK] Seq=1 Ack=1001 Win=45696 Len=25 TSval=2804770971 TSecr=2804770971","127.0.0.1"
"14","TCP","66","0.000249908","127.0.0.1","37022  >  42002 [ACK] Seq=1001 Ack=26 Win=43776 Len=0 TSval=2804770971 TSecr=2804770971","127.0.0.1"
"15","TCP","74","0.000271062","127.0.0.1","54582  >  44002 [SYN] Seq=0 Win=43690 Len=0 MSS=65495 SACK_PERM=1 TSval=2804770971 TSecr=0 WS=128","127.0.0.1"
"16","TCP","74","0.000275724","127.0.0.1","44002  >  54582 [SYN, ACK] Seq=0 Ack=1 Win=43690 Len=0 MSS=65495 SACK_PERM=1 TSval=2804770971 TSecr=2804770971 WS=128","127.0.0.1"
"17","TCP","66","0.000280724","127.0.0.1","54582  >  44002 [ACK] Seq=1 Ack=1 Win=43776 Len=0 TSval=2804770971 TSecr=2804770971","127.0.0.1"
"18","TCP","1066","0.000289546","127.0.0.1","54582  >  44002 [PSH, ACK] Seq=1 Ack=1 Win=43776 Len=1000 TSval=2804770971 TSecr=2804770971","127.0.0.1"
"19","TCP","66","0.000292465","127.0.0.1","44002  >  54582 [ACK] Seq=1 Ack=1001 Win=45696 Len=0 TSval=2804770971 TSecr=2804770971","127.0.0.1"
"20","TCP","130","0.000422491","127.0.0.1","44002  >  54582 [PSH, ACK] Seq=1 Ack=1001 Win=45696 Len=64 TSval=2804770972 TSecr=2804770971","127.0.0.1"
"21","TCP","66","0.000433660","127.0.0.1","54582  >  44002 [ACK] Seq=1001 Ack=65 Win=43776 Len=0 TSval=2804770972 TSecr=2804770972","127.0.0.1"
"22","TCP","74","0.000458652","127.0.0.1","56978  >  43002 [SYN] Seq=0 Win=43690 Len=0 MSS=65495 SACK_PERM=1 TSval=2804770972 TSecr=0 WS=128","127.0.0.1"
"23","TCP","74","0.000463460","127.0.0.1","43002  >  56978 [SYN, ACK] Seq=0 Ack=1 Win=43690 Len=0 MSS=65495 SACK_PERM=1 TSval=2804770972 TSecr=2804770972 WS=128","127.0.0.1"
"24","TCP","66","0.000468654","127.0.0.1","56978  >  43002 [ACK] Seq=1 Ack=1 Win=43776 Len=0 TSval=2804770972 TSecr=2804770972","127.0.0.1"
"25","TCP","106","0.000478004","127.0.0.1","56978  >  43002 [PSH, ACK] Seq=1 Ack=1 Win=43776 Len=40 TSval=2804770972 TSecr=2804770972","127.0.0.1"
"26","TCP","66","0.000493140","127.0.0.1","43002  >  56978 [ACK] Seq=1 Ack=41 Win=43776 Len=0 TSval=2804770972 TSecr=2804770972","127.0.0.1"
"27","TCP","78","0.000500042","127.0.0.1","43002  >  56978 [PSH, ACK] Seq=1 Ack=41 Win=43776 Len=12 TSval=2804770972 TSecr=2804770972","127.0.0.1"
"28","TCP","66","0.000506772","127.0.0.1","56978  >  43002 [ACK] Seq=41 Ack=13 Win=43776 Len=0 TSval=2804770972 TSecr=2804770972","127.0.0.1"
"29","TCP","74","0.000526267","127.0.0.1","37028  >  42002 [SYN] Seq=0 Win=43690 Len=0 MSS=65495 SACK_PERM=1 TSval=2804770972 TSecr=0 WS=128","127.0.0.1"
"30","TCP","74","0.000530584","127.0.0.1","42002  >  37028 [SYN, ACK] Seq=0 Ack=1 Win=43690 Len=0 MSS=65495 SACK_PERM=1 TSval=2804770972 TSecr=2804770972 WS=128","127.0.0.1"
"31","TCP","66","0.000535169","127.0.0.1","37028  >  42002 [ACK] Seq=1 Ack=1 Win=43776 Len=0 TSval=2804770972 TSecr=2804770972","127.0.0.1"
"32","TCP","1066","0.000543384","127.0.0.1","37028  >  42002 [PSH, ACK] Seq=1 Ack=1 Win=43776 Len=1000 TSval=2804770972 TSecr=2804770972","127.0.0.1"
"33","TCP","66","0.000546359","127.0.0.1","42002  >  37028 [ACK] Seq=1 Ack=1001 Win=45696 Len=0 TSval=2804770972 TSecr=2804770972","127.0.0.1"
"34","TCP","91","0.000641698","127.0.0.1","42002  >  37028 [PSH, ACK] Seq=1 Ack=1001 Win=45696 Len=25 TSval=2804770972 TSecr=2804770972","127.0.0.1"
"35","TCP","66","0.000651735","127.0.0.1","37028  >  42002 [ACK] Seq=1001 Ack=26 Win=43776 Len=0 TSval=2804770972 TSecr=2804770972","127.0.0.1"
"36","TCP","74","0.000675312","127.0.0.1","54588  >  44002 [SYN] Seq=0 Win=43690 Len=0 MSS=65495 SACK_PERM=1 TSval=2804770972 TSecr=0 WS=128","127.0.0.1"
"37","TCP","74","0.000679998","127.0.0.1","44002  >  54588 [SYN, ACK] Seq=0 Ack=1 Win=43690 Len=0 MSS=65495 SACK_PERM=1 TSval=2804770972 TSecr=2804770972 WS=128","127.0.0.1"
"38","TCP","66","0.000684844","127.0.0.1","54588  >  44002 [ACK] Seq=1 Ack=1 Win=43776 Len=0 TSval=2804770972 TSecr=2804770972","127.0.0.1"
"39","TCP","1066","0.000693798","127.0.0.1","54588  >  44002 [PSH, ACK] Seq=1 Ack=1 Win=43776 Len=1000 TSval=2804770972 TSecr=2804770972","127.0.0.1"
"40","TCP","66","0.000696659","127.0.0.1","44002  >  54588 [ACK] Seq=1 Ack=1001 Win=45696 Len=0 TSval=2804770972 TSecr=2804770972","127.0.0.1"
"41","TCP","130","0.000801260","127.0.0.1","44002  >  54588 [PSH, ACK] Seq=1 Ack=1001 Win=45696 Len=64 TSval=2804770972 TSecr=2804770972","127.0.0.1"
"42","TCP","66","0.000809906","127.0.0.1","54588  >  44002 [ACK] Seq=1001 Ack=65 Win=43776 Len=0 TSval=2804770972 TSecr=2804770972","127.0.0.1"
"43","TCP","74","0.000833210","127.0.0.1","56984  >  43002 [SYN] Seq=0 Win=43690 Len=0 MSS=65495 SACK_PERM=1 TSval=2804770972 TSecr=0 WS=128","127.0.0.1"
"44","TCP","74","0.000837778","127.0.0.1","43002  >  56984 [SYN, ACK] Seq=0 Ack=1 Win=43690 Len=0 MSS=65495 SACK_PERM=1 TSval=2804770972 TSecr=2804770972 WS=128","127.0.0.1"
"45","TCP","66","0.000842516","127.0.0.1","56984  >  43002 [ACK] Seq=1 Ack=1 Win=43776 Len=0 TSval=2804770972 TSecr=2804770972","127.0.0.1"
"46","TCP","106","0.000851075","127.0.0.1","56984  >  43002 [PSH, ACK] Seq=1 Ack=1 Win=43776 Len=40 TSval=2804770972 TSecr=2804770972","127.0.0.1"
"47","TCP","66","0.000857327","127.0.0.1","43002  >  56984 [ACK] Seq=1 Ack=41 Win=43776 Len=0 TSval=2804770972 TSecr=2804770972","127.0.0.1"
"48","TCP","78","0.000862795","127.0.0.1","43002  >  56984 [PSH, ACK] Seq=1 Ack=41 Win=43776 Len=12 TSval=2804770972 TSecr=2804770972","127.0.0.1"
"49","TCP","66","0.000869100","127.0.0.1","56984  >  43002 [ACK] Seq=41 Ack=13 Win=43776 Len=0 TSval=2804770972 TSecr=2804770972","127.0.0.1"
"50","TCP","74","0.000887596","127.0.0.1","37034  >  42002 [SYN] Seq=0 Win=43690 Len=0 MSS=65495 SACK_PERM=1 TSval=2804770972 TSecr=0 WS=128","127.0.0.1"
"51","TCP","74","0.000892136","127.0.0.1","42002  >  37034 [SYN, ACK] Seq=0 Ack=1 Win=43690 Len=0 MSS=65495 SACK_PERM=1 TSval=2804770972 TSecr=2804770972 WS=128","127.0.0.1"
"52","TCP","66","0.000896992","127.0.0.1","37034  >  42002 [ACK] Seq=1 Ack=1 Win=43776 Len=0 TSval=2804770972 TSecr=2804770972","127.0.0.1"
"53","TCP","1066","0.000905382","127.0.0.1","37034  >  42002 [PSH, ACK] Seq=1 Ack=1 Win=43776 Len=1000 TSval=2804770972 TSecr=2804770972","127.0.0.1"
"54","TCP","66","0.000908182","127.0.0.1","42002  >  37034 [ACK] Seq=1 Ack=1001 Win=45696 Len=0 TSval=2804770972 TSecr=2804770972","127.0.0.1"
"55","TCP","91","0.000986586","127.0.0.1","42002  >  37034 [PSH, ACK] Seq=1 Ack=1001 Win=45696 Len=25 TSval=2804770972 TSecr=2804770972","127.0.0.1"
"56","TCP","66","0.000997837","127.0.0.1","37034  >  42002 [ACK] Seq=1001 Ack=26 Win=43776 Len=0 TSval=2804770972 TSecr=2804770972","127.0.0.1"
"57","TCP","74","0.001036473","127.0.0.1","54594  >  44002 [SYN] Seq=0 Win=43690 Len=0 MSS=65495 SACK_PERM=1 TSval=2804770972 TSecr=0 WS=128","127.0.0.1"
"58","TCP","74","0.001043727","127.0.0.1","44002  >  54594 [SYN, ACK] Seq=0 Ack=1 Win=43690 Len=0 MSS=65495 SACK_PERM=1 TSval=2804770972 TSecr=2804770972 WS=128","127.0.0.1"
"59","TCP","66","0.001050839","127.0.0.1","54594  >  44002 [ACK] Seq=1 Ack=1 Win=43776 Len=0 TSval=2804770972 TSecr=2804770972","127.0.0.1"
"60","TCP","1066","0.001062220","127.0.0.1","54594  >  44002 [PSH, ACK] Seq=1 Ack=1 Win=43776 Len=1000 TSval=2804770972 TSecr=2804770972","127.0.0.1"
"61","TCP","66","0.001065789","127.0.0.1","44002  >  54594 [ACK] Seq=1 Ack=1001 Win=45696 Len=0 TSval=2804770972 TSecr=2804770972","127.0.0.1"
"62","TCP","130","0.001130613","127.0.0.1","44002  >  54594 [PSH, ACK] Seq=1 Ack=1001 Win=45696 Len=64 TSval=2804770972 TSecr=2804770972","127.0.0.1"
"63","TCP","66","0.001137751","127.0.0.1","54594  >  44002 [ACK] Seq=1001 Ack=65 Win=43776 Len=0 TSval=2804770972 TSecr=2804770972","127.0.0.1"
"64","TCP","74","0.001161240","127.0.0.1","56990  >  43002 [SYN] Seq=0 Win=43690 Len=0 MSS=65495 SACK_PERM=1 TSval=2804770972 TSecr=0 WS=128","127.0.0.1"
"65","TCP","74","0.001166254","127.0.0.1","43002  >  56990 [SYN, ACK] Seq=0 Ack=1 Win=43690 Len=0 MSS=65495 SACK_PERM=1 TSval=2804770972 TSecr=2804770972 WS=128","127.0.0.1"
"66","TCP","66","0.001171733","127.0.0.1","56990  >  43002 [ACK] Seq=1 Ack=1 Win=43776 Len=0 TSval=2804770972 TSecr=2804770972","127.0.0.1"
"67","TCP","106","0.001182537","127.0.0.1","56990  >  43002 [PSH, ACK] Seq=1 Ack=1 Win=43776 Len=40 TSval=2804770972 TSecr=2804770972","127.0.0.1"
"68","TCP","66","0.001190211","127.0.0.1","43002  >  56990 [ACK] Seq=1 Ack=41 Win=43776 Len=0 TSval=2804770972 TSecr=2804770972","127.0.0.1"
"69","TCP","78","0.001197399","127.0.0.1","43002  >  56990 [PSH, ACK] Seq=1 Ack=41 Win=43776 Len=12 TSval=2804770972 TSecr=2804770972","127.0.0.1"
"70","TCP","66","0.001204456","127.0.0.1","56990  >  43002 [ACK] Seq=41 Ack=13 Win=43776 Len=0 TSval=2804770972 TSecr=2804770972","127.0.0.1"
"71","TCP","74","0.001226216","127.0.0.1","37040  >  42002 [SYN] Seq=0 Win=43690 Len=0 MSS=65495 SACK_PERM=1 TSval=2804770972 TSecr=0 WS=128","127.0.0.1"
"72","TCP","74","0.001230714","127.0.0.1","42002  >  37040 [SYN, ACK] Seq=0 Ack=1 Win=43690 Len=0 MSS=65495 SACK_PERM=1 TSval=2804770972 TSecr=2804770972 WS=128","127.0.0.1"
"73","TCP","66","0.001235591","127.0.0.1","37040  >  42002 [ACK] Seq=1 Ack=1 Win=43776 Len=0 TSval=2804770972 TSecr=2804770972","127.0.0.1"
"74","TCP","1066","0.001244550","127.0.0.1","37040  >  42002 [PSH, ACK] Seq=1 Ack=1 Win=43776 Len=1000 TSval=2804770972 TSecr=2804770972","127.0.0.1"
"75","TCP","66","0.001247557","127.0.0.1","42002  >  37040 [ACK] Seq=1 Ack=1001 Win=45696 Len=0 TSval=2804770972 TSecr=2804770972","127.0.0.1"
"76","TCP","91","0.001328757","127.0.0.1","42002  >  37040 [PSH, ACK] Seq=1 Ack=1001 Win=45696 Len=25 TSval=2804770972 TSecr=2804770972","127.0.0.1"
"77","TCP","66","0.001335360","127.0.0.1","37040  >  42002 [ACK] Seq=1001 Ack=26 Win=43776 Len=0 TSval=2804770972 TSecr=2804770972","127.0.0.1"
"78","TCP","74","0.001354631","127.0.0.1","54600  >  44002 [SYN] Seq=0 Win=43690 Len=0 MSS=65495 SACK_PERM=1 TSval=2804770972 TSecr=0 WS=128","127.0.0.1"
"79","TCP","74","0.001358916","127.0.0.1","44002  >  54600 [SYN, ACK] Seq=0 Ack=1 Win=43690 Len=0 MSS=65495 SACK_PERM=1 TSval=2804770972 TSecr=2804770972 WS=128","127.0.0.1"
"80","TCP","66","0.001363449","127.0.0.1","54600  >  44002 [ACK] Seq=1 Ack=1 Win=43776 Len=0 TSval=2804770972 TSecr=2804770972","127.0.0.1"
"81","TCP","1066","0.001371774","127.0.0.1","54600  >  44002 [PSH, ACK] Seq=1 Ack=1 Win=43776 Len=1000 TSval=2804770972 TSecr=2804770972","127.0.0.1"
"82","TCP","66","0.001374496","127.0.0.1","44002  >  54600 [ACK] Seq=1 Ack=1001 Win=45696 Len=0 TSval=2804770972 TSecr=2804770972","127.0.0.1"
"83","TCP","130","0.001487601","127.0.0.1","44002  >  54600 [PSH, ACK] Seq=1 Ack=1001 Win=45696 Len=64 TSval=2804770972 TSecr=2804770972","127.0.0.1"
"84","TCP","66","0.001501665","127.0.0.1","54600  >  44002 [ACK] Seq=1001 Ack=65 Win=43776 Len=0 TSval=2804770972 TSecr=2804770972","127.0.0.1"
"85","TCP","74","2.508519474","127.0.0.1","56996  >  43002 [SYN] Seq=0 Win=43690 Len=0 MSS=65495 SACK_PERM=1 TSval=2804771724 TSecr=0 WS=128","127.0.0.1"
"86","TCP","74","2.508549195","127.0.0.1","43002  >  56996 [SYN, ACK] Seq=0 Ack=1 Win=43690 Len=0 MSS=65495 SACK_PERM=1 TSval=2804771724 TSecr=2804771724 WS=128","127.0.0.1"
"87","TCP","66","2.508574649","127.0.0.1","56996  >  43002 [ACK] Seq=1 Ack=1 Win=43776 Len=0 TSval=2804771724 TSecr=2804771724","127.0.0.1"
"88","TCP","106","2.508610513","127.0.0.1","56996  >  43002 [PSH, ACK] Seq=1 Ack=1 Win=43776 Len=40 TSval=2804771724 TSecr=2804771724","127.0.0.1"
"89","TCP","66","2.508643988","127.0.0.1","43002  >  56996 [ACK] Seq=1 Ack=41 Win=43776 Len=0 TSval=2804771724 TSecr=2804771724","127.0.0.1"
"90","TCP","78","2.508680529","127.0.0.1","43002  >  56996 [PSH, ACK] Seq=1 Ack=41 Win=43776 Len=12 TSval=2804771724 TSecr=2804771724","127.0.0.1"
"91","TCP","66","2.508701922","127.0.0.1","56996  >  43002 [ACK] Seq=41 Ack=13 Win=43776 Len=0 TSval=2804771724 TSecr=2804771724","127.0.0.1"
"92","TCP","74","2.508767973","127.0.0.1","37046  >  42002 [SYN] Seq=0 Win=43690 Len=0 MSS=65495 SACK_PERM=1 TSval=2804771724 TSecr=0 WS=128","127.0.0.1"
"93","TCP","74","2.508781531","127.0.0.1","42002  >  37046 [SYN, ACK] Seq=0 Ack=1 Win=43690 Len=0 MSS=65495 SACK_PERM=1 TSval=2804771724 TSecr=2804771724 WS=128","127.0.0.1"
"94","TCP","66","2.508795916","127.0.0.1","37046  >  42002 [ACK] Seq=1 Ack=1 Win=43776 Len=0 TSval=2804771724 TSecr=2804771724","127.0.0.1"
"95","TCP","1066","2.508820100","127.0.0.1","37046  >  42002 [PSH, ACK] Seq=1 Ack=1 Win=43776 Len=1000 TSval=2804771724 TSecr=2804771724","127.0.0.1"
"96","TCP","66","2.508829433","127.0.0.1","42002  >  37046 [ACK] Seq=1 Ack=1001 Win=45696 Len=0 TSval=2804771724 TSecr=2804771724","127.0.0.1"
"97","TCP","91","2.509079741","127.0.0.1","42002  >  37046 [PSH, ACK] Seq=1 Ack=1001 Win=45696 Len=25 TSval=2804771724 TSecr=2804771724","127.0.0.1"
"98","TCP","66","2.509105402","127.0.0.1","37046  >  42002 [ACK] Seq=1001 Ack=26 Win=43776 Len=0 TSval=2804771724 TSecr=2804771724","127.0.0.1"
"99","TCP","74","2.509158633","127.0.0.1","54606  >  44002 [SYN] Seq=0 Win=43690 Len=0 MSS=65495 SACK_PERM=1 TSval=2804771724 TSecr=0 WS=128","127.0.0.1"
"100","TCP","74","2.509170252","127.0.0.1","44002  >  54606 [SYN, ACK] Seq=0 Ack=1 Win=43690 Len=0 MSS=65495 SACK_PERM=1 TSval=2804771724 TSecr=2804771724 WS=128","127.0.0.1"
"101","TCP","66","2.509182165","127.0.0.1","54606  >  44002 [ACK] Seq=1 Ack=1 Win=43776 Len=0 TSval=2804771724 TSecr=2804771724","127.0.0.1"
"102","TCP","1066","2.509205266","127.0.0.1","54606  >  44002 [PSH, ACK] Seq=1 Ack=1 Win=43776 Len=1000 TSval=2804771724 TSecr=2804771724","127.0.0.1"
"103","TCP","66","2.509212687","127.0.0.1","44002  >  54606 [ACK] Seq=1 Ack=1001 Win=45696 Len=0 TSval=2804771724 TSecr=2804771724","127.0.0.1"
"104","TCP","130","2.509442332","127.0.0.1","44002  >  54606 [PSH, ACK] Seq=1 Ack=1001 Win=45696 Len=64 TSval=2804771724 TSecr=2804771724","127.0.0.1"
"105","TCP","66","2.509467473","127.0.0.1","54606  >  44002 [ACK] Seq=1001 Ack=65 Win=43776 Len=0 TSval=2804771724 TSecr=2804771724","127.0.0.1"
"106","TCP","74","2.509516018","127.0.0.1","57002  >  43002 [SYN] Seq=0 Win=43690 Len=0 MSS=65495 SACK_PERM=1 TSval=2804771724 TSecr=0 WS=128","127.0.0.1"
"107","TCP","74","2.509527395","127.0.0.1","43002  >  57002 [SYN, ACK] Seq=0 Ack=1 Win=43690 Len=0 MSS=65495 SACK_PERM=1 TSval=2804771724 TSecr=2804771724 WS=128","127.0.0.1"
"108","TCP","66","2.509539481","127.0.0.1","57002  >  43002 [ACK] Seq=1 Ack=1 Win=43776 Len=0 TSval=2804771724 TSecr=2804771724","127.0.0.1"
"109","TCP","106","2.509561404","127.0.0.1","57002  >  43002 [PSH, ACK] Seq=1 Ack=1 Win=43776 Len=40 TSval=2804771724 TSecr=2804771724","127.0.0.1"
"110","TCP","66","2.509580144","127.0.0.1","43002  >  57002 [ACK] Seq=1 Ack=41 Win=43776 Len=0 TSval=2804771724 TSecr=2804771724","127.0.0.1"
"111","TCP","78","2.509594773","127.0.0.1","43002  >  57002 [PSH, ACK] Seq=1 Ack=41 Win=43776 Len=12 TSval=2804771724 TSecr=2804771724","127.0.0.1"
"112","TCP","66","2.509611494","127.0.0.1","57002  >  43002 [ACK] Seq=41 Ack=13 Win=43776 Len=0 TSval=2804771724 TSecr=2804771724","127.0.0.1"
"113","TCP","74","2.509659692","127.0.0.1","37052  >  42002 [SYN] Seq=0 Win=43690 Len=0 MSS=65495 SACK_PERM=1 TSval=2804771724 TSecr=0 WS=128","127.0.0.1"
"114","TCP","74","2.509670518","127.0.0.1","42002  >  37052 [SYN, ACK] Seq=0 Ack=1 Win=43690 Len=0 MSS=65495 SACK_PERM=1 TSval=2804771724 TSecr=2804771724 WS=128","127.0.0.1"
"115","TCP","66","2.509682506","127.0.0.1","37052  >  42002 [ACK] Seq=1 Ack=1 Win=43776 Len=0 TSval=2804771724 TSecr=2804771724","127.0.0.1"
"116","TCP","1066","2.509704472","127.0.0.1","37052  >  42002 [PSH, ACK] Seq=1 Ack=1 Win=43776 Len=1000 TSval=2804771724 TSecr=2804771724","127.0.0.1"
"117","TCP","66","2.509711929","127.0.0.1","42002  >  37052 [ACK] Seq=1 Ack=1001 Win=45696 Len=0 TSval=2804771724 TSecr=2804771724","127.0.0.1"
"118","TCP","91","2.509924583","127.0.0.1","42002  >  37052 [PSH, ACK] Seq=1 Ack=1001 Win=45696 Len=25 TSval=2804771724 TSecr=2804771724","127.0.0.1"
"119","TCP","66","2.509954319","127.0.0.1","37052  >  42002 [ACK] Seq=1001 Ack=26 Win=43776 Len=0 TSval=2804771724 TSecr=2804771724","127.0.0.1"
"120","TCP","74","2.510057158","127.0.0.1","54612  >  44002 [SYN] Seq=0 Win=43690 Len=0 MSS=65495 SACK_PERM=1 TSval=2804771724 TSecr=0 WS=128","127.0.0.1"
"121","TCP","74","2.510075256","127.0.0.1","44002  >  54612 [SYN, ACK] Seq=0 Ack=1 Win=43690 Len=0 MSS=65495 SACK_PERM=1 TSval=2804771724 TSecr=2804771724 WS=128","127.0.0.1"
"122","TCP","66","2.510093995","127.0.0.1","54612  >  44002 [ACK] Seq=1 Ack=1 Win=43776 Len=0 TSval=2804771724 TSecr=2804771724","127.0.0.1"
"123","TCP","1066","2.510123784","127.0.0.1","54612  >  44002 [PSH, ACK] Seq=1 Ack=1 Win=43776 Len=1000 TSval=2804771724 TSecr=2804771724","127.0.0.1"
"124","TCP","66","2.510132965","127.0.0.1","44002  >  54612 [ACK] Seq=1 Ack=1001 Win=45696 Len=0 TSval=2804771724 TSecr=2804771724","127.0.0.1"
"125","TCP","130","2.510358700","127.0.0.1","44002  >  54612 [PSH, ACK] Seq=1 Ack=1001 Win=45696 Len=64 TSval=2804771724 TSecr=2804771724","127.0.0.1"
"126","TCP","66","2.510413201","127.0.0.1","54612  >  44002 [ACK] Seq=1001 Ack=65 Win=43776 Len=0 TSval=2804771725 TSecr=2804771724","127.0.0.1"
"127","TCP","74","2.510474518","127.0.0.1","57008  >  43002 [SYN] Seq=0 Win=43690 Len=0 MSS=65495 SACK_PERM=1 TSval=2804771725 TSecr=0 WS=128","127.0.0.1"
"128","TCP","74","2.510488390","127.0.0.1","43002  >  57008 [SYN, ACK] Seq=0 Ack=1 Win=43690 Len=0 MSS=65495 SACK_PERM=1 TSval=2804771725 TSecr=2804771725 WS=128","127.0.0.1"
"129","TCP","66","2.510502413","127.0.0.1","57008  >  43002 [ACK] Seq=1 Ack=1 Win=43776 Len=0 TSval=2804771725 TSecr=2804771725","127.0.0.1"
"130","TCP","106","2.510527779","127.0.0.1","57008  >  43002 [PSH, ACK] Seq=1 Ack=1 Win=43776 Len=40 TSval=2804771725 TSecr=2804771725","127.0.0.1"
"131","TCP","66","2.510549279","127.0.0.1","43002  >  57008 [ACK] Seq=1 Ack=41 Win=43776 Len=0 TSval=2804771725 TSecr=2804771725","127.0.0.1"
"132","TCP","78","2.510565806","127.0.0.1","43002  >  57008 [PSH, ACK] Seq=1 Ack=41 Win=43776 Len=12 TSval=2804771725 TSecr=2804771725","127.0.0.1"
"133","TCP","66","2.510583386","127.0.0.1","57008  >  43002 [ACK] Seq=41 Ack=13 Win=43776 Len=0 TSval=2804771725 TSecr=2804771725","127.0.0.1"
"134","TCP","74","2.510637072","127.0.0.1","37058  >  42002 [SYN] Seq=0 Win=43690 Len=0 MSS=65495 SACK_PERM=1 TSval=2804771725 TSecr=0 WS=128","127.0.0.1"
"135","TCP","74","2.510648745","127.0.0.1","42002  >  37058 [SYN, ACK] Seq=0 Ack=1 Win=43690 Len=0 MSS=65495 SACK_PERM=1 TSval=2804771725 TSecr=2804771725 WS=128","127.0.0.1"
"136","TCP","66","2.510660656","127.0.0.1","37058  >  42002 [ACK] Seq=1 Ack=1 Win=43776 Len=0 TSval=2804771725 TSecr=2804771725","127.0.0.1"
"137","TCP","1066","2.510686071","127.0.0.1","37058  >  42002 [PSH, ACK] Seq=1 Ack=1 Win=43776 Len=1000 TSval=2804771725 TSecr=2804771725","127.0.0.1"
"138","TCP","66","2.510697673","127.0.0.1","42002  >  37058 [ACK] Seq=1 Ack=1001 Win=45696 Len=0 TSval=2804771725 TSecr=2804771725","127.0.0.1"
"139","TCP","91","2.510917148","127.0.0.1","42002  >  37058 [PSH, ACK] Seq=1 Ack=1001 Win=45696 Len=25 TSval=2804771725 TSecr=2804771725","127.0.0.1"
"140","TCP","66","2.510943207","127.0.0.1","37058  >  42002 [ACK] Seq=1001 Ack=26 Win=43776 Len=0 TSval=2804771725 TSecr=2804771725","127.0.0.1"
"141","TCP","74","2.511013761","127.0.0.1","54618  >  44002 [SYN] Seq=0 Win=43690 Len=0 MSS=65495 SACK_PERM=1 TSval=2804771725 TSecr=0 WS=128","127.0.0.1"
"142","TCP","74","2.511026515","127.0.0.1","44002  >  54618 [SYN, ACK] Seq=0 Ack=1 Win=43690 Len=0 MSS=65495 SACK_PERM=1 TSval=2804771725 TSecr=2804771725 WS=128","127.0.0.1"
"143","TCP","66","2.511039803","127.0.0.1","54618  >  44002 [ACK] Seq=1 Ack=1 Win=43776 Len=0 TSval=2804771725 TSecr=2804771725","127.0.0.1"
"144","TCP","1066","2.511064779","127.0.0.1","54618  >  44002 [PSH, ACK] Seq=1 Ack=1 Win=43776 Len=1000 TSval=2804771725 TSecr=2804771725","127.0.0.1"
"145","TCP","66","2.511075981","127.0.0.1","44002  >  54618 [ACK] Seq=1 Ack=1001 Win=45696 Len=0 TSval=2804771725 TSecr=2804771725","127.0.0.1"
"146","TCP","130","2.511266885","127.0.0.1","44002  >  54618 [PSH, ACK] Seq=1 Ack=1001 Win=45696 Len=64 TSval=2804771725 TSecr=2804771725","127.0.0.1"
"147","TCP","66","2.511288181","127.0.0.1","54618  >  44002 [ACK] Seq=1001 Ack=65 Win=43776 Len=0 TSval=2804771725 TSecr=2804771725","127.0.0.1"
"148","TCP","74","2.511347131","127.0.0.1","57014  >  43002 [SYN] Seq=0 Win=43690 Len=0 MSS=65495 SACK_PERM=1 TSval=2804771725 TSecr=0 WS=128","127.0.0.1"
"149","TCP","74","2.511359216","127.0.0.1","43002  >  57014 [SYN, ACK] Seq=0 Ack=1 Win=43690 Len=0 MSS=65495 SACK_PERM=1 TSval=2804771725 TSecr=2804771725 WS=128","127.0.0.1"
"150","TCP","66","2.511371336","127.0.0.1","57014  >  43002 [ACK] Seq=1 Ack=1 Win=43776 Len=0 TSval=2804771725 TSecr=2804771725","127.0.0.1"
"151","TCP","106","2.511394786","127.0.0.1","57014  >  43002 [PSH, ACK] Seq=1 Ack=1 Win=43776 Len=40 TSval=2804771725 TSecr=2804771725","127.0.0.1"
"152","TCP","66","2.511413377","127.0.0.1","43002  >  57014 [ACK] Seq=1 Ack=41 Win=43776 Len=0 TSval=2804771725 TSecr=2804771725","127.0.0.1"
"153","TCP","78","2.511427105","127.0.0.1","43002  >  57014 [PSH, ACK] Seq=1 Ack=41 Win=43776 Len=12 TSval=2804771725 TSecr=2804771725","127.0.0.1"
"154","TCP","66","2.511443550","127.0.0.1","57014  >  43002 [ACK] Seq=41 Ack=13 Win=43776 Len=0 TSval=2804771725 TSecr=2804771725","127.0.0.1"
"155","TCP","74","2.511492031","127.0.0.1","37064  >  42002 [SYN] Seq=0 Win=43690 Len=0 MSS=65495 SACK_PERM=1 TSval=2804771725 TSecr=0 WS=128","127.0.0.1"
"156","TCP","74","2.511503099","127.0.0.1","42002  >  37064 [SYN, ACK] Seq=0 Ack=1 Win=43690 Len=0 MSS=65495 SACK_PERM=1 TSval=2804771725 TSecr=2804771725 WS=128","127.0.0.1"
"157","TCP","66","2.511514801","127.0.0.1","37064  >  42002 [ACK] Seq=1 Ack=1 Win=43776 Len=0 TSval=2804771725 TSecr=2804771725","127.0.0.1"
"158","TCP","1066","2.511535713","127.0.0.1","37064  >  42002 [PSH, ACK] Seq=1 Ack=1 Win=43776 Len=1000 TSval=2804771725 TSecr=2804771725","127.0.0.1"
"159","TCP","66","2.511543301","127.0.0.1","42002  >  37064 [ACK] Seq=1 Ack=1001 Win=45696 Len=0 TSval=2804771725 TSecr=2804771725","127.0.0.1"
"160","TCP","91","2.511790972","127.0.0.1","42002  >  37064 [PSH, ACK] Seq=1 Ack=1001 Win=45696 Len=25 TSval=2804771725 TSecr=2804771725","127.0.0.1"
"161","TCP","66","2.511809232","127.0.0.1","37064  >  42002 [ACK] Seq=1001 Ack=26 Win=43776 Len=0 TSval=2804771725 TSecr=2804771725","127.0.0.1"
"162","TCP","74","2.511857098","127.0.0.1","54624  >  44002 [SYN] Seq=0 Win=43690 Len=0 MSS=65495 SACK_PERM=1 TSval=2804771725 TSecr=0 WS=128","127.0.0.1"
"163","TCP","74","2.511867549","127.0.0.1","44002  >  54624 [SYN, ACK] Seq=0 Ack=1 Win=43690 Len=0 MSS=65495 SACK_PERM=1 TSval=2804771725 TSecr=2804771725 WS=128","127.0.0.1"
"164","TCP","66","2.511879121","127.0.0.1","54624  >  44002 [ACK] Seq=1 Ack=1 Win=43776 Len=0 TSval=2804771725 TSecr=2804771725","127.0.0.1"
"165","TCP","1066","2.511900121","127.0.0.1","54624  >  44002 [PSH, ACK] Seq=1 Ack=1 Win=43776 Len=1000 TSval=2804771725 TSecr=2804771725","127.0.0.1"
"166","TCP","66","2.511907126","127.0.0.1","44002  >  54624 [ACK] Seq=1 Ack=1001 Win=45696 Len=0 TSval=2804771725 TSecr=2804771725","127.0.0.1"
"167","TCP","130","2.512161661","127.0.0.1","44002  >  54624 [PSH, ACK] Seq=1 Ack=1001 Win=45696 Len=64 TSval=2804771725 TSecr=2804771725","127.0.0.1"
"168","TCP","66","2.512183554","127.0.0.1","54624  >  44002 [ACK] Seq=1001 Ack=65 Win=43776 Len=0 TSval=2804771725 TSecr=2804771725","127.0.0.1"
"169","TCP","74","3.013664602","127.0.0.1","57020  >  43002 [SYN] Seq=0 Win=43690 Len=0 MSS=65495 SACK_PERM=1 TSval=2804771875 TSecr=0 WS=128","127.0.0.1"
"170","TCP","74","3.013673915","127.0.0.1","43002  >  57020 [SYN, ACK] Seq=0 Ack=1 Win=43690 Len=0 MSS=65495 SACK_PERM=1 TSval=2804771875 TSecr=2804771875 WS=128","127.0.0.1"
"171","TCP","66","3.013681523","127.0.0.1","57020  >  43002 [ACK] Seq=1 Ack=1 Win=43776 Len=0 TSval=2804771875 TSecr=2804771875","127.0.0.1"
"172","TCP","106","3.013691706","127.0.0.1","57020  >  43002 [PSH, ACK] Seq=1 Ack=1 Win=43776 Len=40 TSval=2804771875 TSecr=2804771875","127.0.0.1"
"173","TCP","66","3.013702190","127.0.0.1","43002  >  57020 [ACK] Seq=1 Ack=41 Win=43776 Len=0 TSval=2804771875 TSecr=2804771875","127.0.0.1"
"174","TCP","78","3.013723482","127.0.0.1","43002  >  57020 [PSH, ACK] Seq=1 Ack=41 Win=43776 Len=12 TSval=2804771876 TSecr=2804771875","127.0.0.1"
"175","TCP","66","3.013729632","127.0.0.1","57020  >  43002 [ACK] Seq=41 Ack=13 Win=43776 Len=0 TSval=2804771876 TSecr=2804771876","127.0.0.1"
"176","TCP","74","3.013747586","127.0.0.1","37070  >  42002 [SYN] Seq=0 Win=43690 Len=0 MSS=65495 SACK_PERM=1 TSval=2804771876 TSecr=0 WS=128","127.0.0.1"
"177","TCP","74","3.013751681","127.0.0.1","42002  >  37070 [SYN, ACK] Seq=0 Ack=1 Win=43690 Len=0 MSS=65495 SACK_PERM=1 TSval=2804771876 TSecr=2804771876 WS=128","127.0.0.1"
"178","TCP","66","3.013755419","127.0.0.1","37070  >  42002 [ACK] Seq=1 Ack=1 Win=43776 Len=0 TSval=2804771876 TSecr=2804771876","127.0.0.1"
"179","TCP","1066","3.013763296","127.0.0.1","37070  >  42002 [PSH, ACK] Seq=1 Ack=1 Win=43776 Len=1000 TSval=2804771876 TSecr=2804771876","127.0.0.1"
"180","TCP","66","3.013766675","127.0.0.1","42002  >  37070 [ACK] Seq=1 Ack=1001 Win=45696 Len=0 TSval=2804771876 TSecr=2804771876","127.0.0.1"
"181","TCP","91","3.013870973","127.0.0.1","42002  >  37070 [PSH, ACK] Seq=1 Ack=1001 Win=45696 Len=25 TSval=2804771876 TSecr=2804771876","127.0.0.1"
"182","TCP","66","3.013878205","127.0.0.1","37070  >  42002 [ACK] Seq=1001 Ack=26 Win=43776 Len=0 TSval=2804771876 TSecr=2804771876","127.0.0.1"
"183","TCP","74","3.013895235","127.0.0.1","54630  >  44002 [SYN] Seq=0 Win=43690 Len=0 MSS=65495 SACK_PERM=1 TSval=2804771876 TSecr=0 WS=128","127.0.0.1"
"184","TCP","74","3.013898928","127.0.0.1","44002  >  54630 [SYN, ACK] Seq=0 Ack=1 Win=43690 Len=0 MSS=65495 SACK_PERM=1 TSval=2804771876 TSecr=2804771876 WS=128","127.0.0.1"
"185","TCP","66","3.013902480","127.0.0.1","54630  >  44002 [ACK] Seq=1 Ack=1 Win=43776 Len=0 TSval=2804771876 TSecr=2804771876","127.0.0.1"
"186","TCP","1066","3.013909465","127.0.0.1","54630  >  44002 [PSH, ACK] Seq=1 Ack=1 Win=43776 Len=1000 TSval=2804771876 TSecr=2804771876","127.0.0.1"
"187","TCP","66","3.013911536","127.0.0.1","44002  >  54630 [ACK] Seq=1 Ack=1001 Win=45696 Len=0 TSval=2804771876 TSecr=2804771876","127.0.0.1"
"188","TCP","130","3.013984107","127.0.0.1","44002  >  54630 [PSH, ACK] Seq=1 Ack=1001 Win=45696 Len=64 TSval=2804771876 TSecr=2804771876","127.0.0.1"
"189","TCP","66","3.013990932","127.0.0.1","54630  >  44002 [ACK] Seq=1001 Ack=65 Win=43776 Len=0 TSval=2804771876 TSecr=2804771876","127.0.0.1"
"190","TCP","74","3.014004746","127.0.0.1","57026  >  43002 [SYN] Seq=0 Win=43690 Len=0 MSS=65495 SACK_PERM=1 TSval=2804771876 TSecr=0 WS=128","127.0.0.1"
"191","TCP","74","3.014007728","127.0.0.1","43002  >  57026 [SYN, ACK] Seq=0 Ack=1 Win=43690 Len=0 MSS=65495 SACK_PERM=1 TSval=2804771876 TSecr=2804771876 WS=128","127.0.0.1"
"192","TCP","66","3.014010738","127.0.0.1","57026  >  43002 [ACK] Seq=1 Ack=1 Win=43776 Len=0 TSval=2804771876 TSecr=2804771876","127.0.0.1"
"193","TCP","106","3.014016256","127.0.0.1","57026  >  43002 [PSH, ACK] Seq=1 Ack=1 Win=43776 Len=40 TSval=2804771876 TSecr=2804771876","127.0.0.1"
"194","TCP","66","3.014021968","127.0.0.1","43002  >  57026 [ACK] Seq=1 Ack=41 Win=43776 Len=0 TSval=2804771876 TSecr=2804771876","127.0.0.1"
"195","TCP","78","3.014028280","127.0.0.1","43002  >  57026 [PSH, ACK] Seq=1 Ack=41 Win=43776 Len=12 TSval=2804771876 TSecr=2804771876","127.0.0.1"
"196","TCP","66","3.014032873","127.0.0.1","57026  >  43002 [ACK] Seq=41 Ack=13 Win=43776 Len=0 TSval=2804771876 TSecr=2804771876","127.0.0.1"
"197","TCP","74","3.014045347","127.0.0.1","37076  >  42002 [SYN] Seq=0 Win=43690 Len=0 MSS=65495 SACK_PERM=1 TSval=2804771876 TSecr=0 WS=128","127.0.0.1"
"198","TCP","74","3.014048663","127.0.0.1","42002  >  37076 [SYN, ACK] Seq=0 Ack=1 Win=43690 Len=0 MSS=65495 SACK_PERM=1 TSval=2804771876 TSecr=2804771876 WS=128","127.0.0.1"
"199","TCP","66","3.014051721","127.0.0.1","37076  >  42002 [ACK] Seq=1 Ack=1 Win=43776 Len=0 TSval=2804771876 TSecr=2804771876","127.0.0.1"
"200","TCP","1066","3.014057848","127.0.0.1","37076  >  42002 [PSH, ACK] Seq=1 Ack=1 Win=43776 Len=1000 TSval=2804771876 TSecr=2804771876","127.0.0.1"
"201","TCP","66","3.014065705","127.0.0.1","42002  >  37076 [ACK] Seq=1 Ack=1001 Win=45696 Len=0 TSval=2804771876 TSecr=2804771876","127.0.0.1"
"202","TCP","91","3.014144103","127.0.0.1","42002  >  37076 [PSH, ACK] Seq=1 Ack=1001 Win=45696 Len=25 TSval=2804771876 TSecr=2804771876","127.0.0.1"
"203","TCP","66","3.014149728","127.0.0.1","37076  >  42002 [ACK] Seq=1001 Ack=26 Win=43776 Len=0 TSval=2804771876 TSecr=2804771876","127.0.0.1"
"204","TCP","74","3.014162284","127.0.0.1","54636  >  44002 [SYN] Seq=0 Win=43690 Len=0 MSS=65495 SACK_PERM=1 TSval=2804771876 TSecr=0 WS=128","127.0.0.1"
"205","TCP","74","3.014165231","127.0.0.1","44002  >  54636 [SYN, ACK] Seq=0 Ack=1 Win=43690 Len=0 MSS=65495 SACK_PERM=1 TSval=2804771876 TSecr=2804771876 WS=128","127.0.0.1"
"206","TCP","66","3.014168678","127.0.0.1","54636  >  44002 [ACK] Seq=1 Ack=1 Win=43776 Len=0 TSval=2804771876 TSecr=2804771876","127.0.0.1"
"207","TCP","1066","3.014174812","127.0.0.1","54636  >  44002 [PSH, ACK] Seq=1 Ack=1 Win=43776 Len=1000 TSval=2804771876 TSecr=2804771876","127.0.0.1"
"208","TCP","66","3.014176811","127.0.0.1","44002  >  54636 [ACK] Seq=1 Ack=1001 Win=45696 Len=0 TSval=2804771876 TSecr=2804771876","127.0.0.1"
"209","TCP","130","3.014239348","127.0.0.1","44002  >  54636 [PSH, ACK] Seq=1 Ack=1001 Win=45696 Len=64 TSval=2804771876 TSecr=2804771876","127.0.0.1"
"210","TCP","66","3.014246687","127.0.0.1","54636  >  44002 [ACK] Seq=1001 Ack=65 Win=43776 Len=0 TSval=2804771876 TSecr=2804771876","127.0.0.1"
"211","TCP","74","3.014274450","127.0.0.1","57032  >  43002 [SYN] Seq=0 Win=43690 Len=0 MSS=65495 SACK_PERM=1 TSval=2804771876 TSecr=0 WS=128","127.0.0.1"
"212","TCP","74","3.014279430","127.0.0.1","43002  >  57032 [SYN, ACK] Seq=0 Ack=1 Win=43690 Len=0 MSS=65495 SACK_PERM=1 TSval=2804771876 TSecr=2804771876 WS=128","127.0.0.1"
"213","TCP","66","3.014284416","127.0.0.1","57032  >  43002 [ACK] Seq=1 Ack=1 Win=43776 Len=0 TSval=2804771876 TSecr=2804771876","127.0.0.1"
"214","TCP","106","3.014294795","127.0.0.1","57032  >  43002 [PSH, ACK] Seq=1 Ack=1 Win=43776 Len=40 TSval=2804771876 TSecr=2804771876","127.0.0.1"
"215","TCP","66","3.014301197","127.0.0.1","43002  >  57032 [ACK] Seq=1 Ack=41 Win=43776 Len=0 TSval=2804771876 TSecr=2804771876","127.0.0.1"
"216","TCP","78","3.014306455","127.0.0.1","43002  >  57032 [PSH, ACK] Seq=1 Ack=41 Win=43776 Len=12 TSval=2804771876 TSecr=2804771876","127.0.0.1"
"217","TCP","66","3.014311034","127.0.0.1","57032  >  43002 [ACK] Seq=41 Ack=13 Win=43776 Len=0 TSval=2804771876 TSecr=2804771876","127.0.0.1"
"218","TCP","74","3.014327684","127.0.0.1","37082  >  42002 [SYN] Seq=0 Win=43690 Len=0 MSS=65495 SACK_PERM=1 TSval=2804771876 TSecr=0 WS=128","127.0.0.1"
"219","TCP","74","3.014331128","127.0.0.1","42002  >  37082 [SYN, ACK] Seq=0 Ack=1 Win=43690 Len=0 MSS=65495 SACK_PERM=1 TSval=2804771876 TSecr=2804771876 WS=128","127.0.0.1"
"220","TCP","66","3.014334996","127.0.0.1","37082  >  42002 [ACK] Seq=1 Ack=1 Win=43776 Len=0 TSval=2804771876 TSecr=2804771876","127.0.0.1"
"221","TCP","1066","3.014341653","127.0.0.1","37082  >  42002 [PSH, ACK] Seq=1 Ack=1 Win=43776 Len=1000 TSval=2804771876 TSecr=2804771876","127.0.0.1"
"222","TCP","66","3.014344098","127.0.0.1","42002  >  37082 [ACK] Seq=1 Ack=1001 Win=45696 Len=0 TSval=2804771876 TSecr=2804771876","127.0.0.1"
"223","TCP","91","3.014406385","127.0.0.1","42002  >  37082 [PSH, ACK] Seq=1 Ack=1001 Win=45696 Len=25 TSval=2804771876 TSecr=2804771876","127.0.0.1"
"224","TCP","66","3.014413007","127.0.0.1","37082  >  42002 [ACK] Seq=1001 Ack=26 Win=43776 Len=0 TSval=2804771876 TSecr=2804771876","127.0.0.1"
"225","TCP","74","3.014430300","127.0.0.1","54642  >  44002 [SYN] Seq=0 Win=43690 Len=0 MSS=65495 SACK_PERM=1 TSval=2804771876 TSecr=0 WS=128","127.0.0.1"
"226","TCP","74","3.014433667","127.0.0.1","44002  >  54642 [SYN, ACK] Seq=0 Ack=1 Win=43690 Len=0 MSS=65495 SACK_PERM=1 TSval=2804771876 TSecr=2804771876 WS=128","127.0.0.1"
"227","TCP","66","3.014437134","127.0.0.1","54642  >  44002 [ACK] Seq=1 Ack=1 Win=43776 Len=0 TSval=2804771876 TSecr=2804771876","127.0.0.1"
"228","TCP","1066","3.014444039","127.0.0.1","54642  >  44002 [PSH, ACK] Seq=1 Ack=1 Win=43776 Len=1000 TSval=2804771876 TSecr=2804771876","127.0.0.1"
"229","TCP","66","3.014446823","127.0.0.1","44002  >  54642 [ACK] Seq=1 Ack=1001 Win=45696 Len=0 TSval=2804771876 TSecr=2804771876","127.0.0.1"
"230","TCP","130","3.014506507","127.0.0.1","44002  >  54642 [PSH, ACK] Seq=1 Ack=1001 Win=45696 Len=64 TSval=2804771876 TSecr=2804771876","127.0.0.1"
"231","TCP","66","3.014513062","127.0.0.1","54642  >  44002 [ACK] Seq=1001 Ack=65 Win=43776 Len=0 TSval=2804771876 TSecr=2804771876","127.0.0.1"
"232","TCP","74","3.014529277","127.0.0.1","57038  >  43002 [SYN] Seq=0 Win=43690 Len=0 MSS=65495 SACK_PERM=1 TSval=2804771876 TSecr=0 WS=128","127.0.0.1"
"233","TCP","74","3.014532497","127.0.0.1","43002  >  57038 [SYN, ACK] Seq=0 Ack=1 Win=43690 Len=0 MSS=65495 SACK_PERM=1 TSval=2804771876 TSecr=2804771876 WS=128","127.0.0.1"
"234","TCP","66","3.014535901","127.0.0.1","57038  >  43002 [ACK] Seq=1 Ack=1 Win=43776 Len=0 TSval=2804771876 TSecr=2804771876","127.0.0.1"
"235","TCP","106","3.014542344","127.0.0.1","57038  >  43002 [PSH, ACK] Seq=1 Ack=1 Win=43776 Len=40 TSval=2804771876 TSecr=2804771876","127.0.0.1"
"236","TCP","66","3.014546726","127.0.0.1","43002  >  57038 [ACK] Seq=1 Ack=41 Win=43776 Len=0 TSval=2804771876 TSecr=2804771876","127.0.0.1"
"237","TCP","78","3.014550704","127.0.0.1","43002  >  57038 [PSH, ACK] Seq=1 Ack=41 Win=43776 Len=12 TSval=2804771876 TSecr=2804771876","127.0.0.1"
"238","TCP","66","3.014554957","127.0.0.1","57038  >  43002 [ACK] Seq=41 Ack=13 Win=43776 Len=0 TSval=2804771876 TSecr=2804771876","127.0.0.1"
"239","TCP","74","3.014568467","127.0.0.1","37088  >  42002 [SYN] Seq=0 Win=43690 Len=0 MSS=65495 SACK_PERM=1 TSval=2804771876 TSecr=0 WS=128","127.0.0.1"
"240","TCP","74","3.014571200","127.0.0.1","42002  >  37088 [SYN, ACK] Seq=0 Ack=1 Win=43690 Len=0 MSS=65495 SACK_PERM=1 TSval=2804771876 TSecr=2804771876 WS=128","127.0.0.1"
"241","TCP","66","3.014574443","127.0.0.1","37088  >  42002 [ACK] Seq=1 Ack=1 Win=43776 Len=0 TSval=2804771876 TSecr=2804771876","127.0.0.1"
"242","TCP","1066","3.014581124","127.0.0.1","37088  >  42002 [PSH, ACK] Seq=1 Ack=1 Win=43776 Len=1000 TSval=2804771876 TSecr=2804771876","127.0.0.1"
"243","TCP","66","3.014583239","127.0.0.1","42002  >  37088 [ACK] Seq=1 Ack=1001 Win=45696 Len=0 TSval=2804771876 TSecr=2804771876","127.0.0.1"
"244","TCP","91","3.014639267","127.0.0.1","42002  >  37088 [PSH, ACK] Seq=1 Ack=1001 Win=45696 Len=25 TSval=2804771876 TSecr=2804771876","127.0.0.1"
"245","TCP","66","3.014643799","127.0.0.1","37088  >  42002 [ACK] Seq=1001 Ack=26 Win=43776 Len=0 TSval=2804771876 TSecr=2804771876","127.0.0.1"
"246","TCP","74","3.014656350","127.0.0.1","54648  >  44002 [SYN] Seq=0 Win=43690 Len=0 MSS=65495 SACK_PERM=1 TSval=2804771876 TSecr=0 WS=128","127.0.0.1"
"247","TCP","74","3.014659328","127.0.0.1","44002  >  54648 [SYN, ACK] Seq=0 Ack=1 Win=43690 Len=0 MSS=65495 SACK_PERM=1 TSval=2804771876 TSecr=2804771876 WS=128","127.0.0.1"
"248","TCP","66","3.014662316","127.0.0.1","54648  >  44002 [ACK] Seq=1 Ack=1 Win=43776 Len=0 TSval=2804771876 TSecr=2804771876","127.0.0.1"
"249","TCP","1066","3.014668184","127.0.0.1","54648  >  44002 [PSH, ACK] Seq=1 Ack=1 Win=43776 Len=1000 TSval=2804771876 TSecr=2804771876","127.0.0.1"
"250","TCP","66","3.014670137","127.0.0.1","44002  >  54648 [ACK] Seq=1 Ack=1001 Win=45696 Len=0 TSval=2804771876 TSecr=2804771876","127.0.0.1"
"251","TCP","130","3.014741550","127.0.0.1","44002  >  54648 [PSH, ACK] Seq=1 Ack=1001 Win=45696 Len=64 TSval=2804771876 TSecr=2804771876","127.0.0.1"
"252","TCP","66","3.014747439","127.0.0.1","54648  >  44002 [ACK] Seq=1001 Ack=65 Win=43776 Len=0 TSval=2804771876 TSecr=2804771876","127.0.0.1"
"253","TCP","74","5.019970649","127.0.0.1","57044  >  43002 [SYN] Seq=0 Win=43690 Len=0 MSS=65495 SACK_PERM=1 TSval=2804772477 TSecr=0 WS=128","127.0.0.1"
"254","TCP","74","5.019996296","127.0.0.1","43002  >  57044 [SYN, ACK] Seq=0 Ack=1 Win=43690 Len=0 MSS=65495 SACK_PERM=1 TSval=2804772477 TSecr=2804772477 WS=128","127.0.0.1"
"255","TCP","66","5.020018758","127.0.0.1","57044  >  43002 [ACK] Seq=1 Ack=1 Win=43776 Len=0 TSval=2804772477 TSecr=2804772477","127.0.0.1"
"256","TCP","106","5.020050306","127.0.0.1","57044  >  43002 [PSH, ACK] Seq=1 Ack=1 Win=43776 Len=40 TSval=2804772477 TSecr=2804772477","127.0.0.1"
"257","TCP","66","5.020084278","127.0.0.1","43002  >  57044 [ACK] Seq=1 Ack=41 Win=43776 Len=0 TSval=2804772477 TSecr=2804772477","127.0.0.1"
"258","TCP","78","5.020115750","127.0.0.1","43002  >  57044 [PSH, ACK] Seq=1 Ack=41 Win=43776 Len=12 TSval=2804772477 TSecr=2804772477","127.0.0.1"
"259","TCP","66","5.020136079","127.0.0.1","57044  >  43002 [ACK] Seq=41 Ack=13 Win=43776 Len=0 TSval=2804772477 TSecr=2804772477","127.0.0.1"
"260","TCP","74","5.020193074","127.0.0.1","37094  >  42002 [SYN] Seq=0 Win=43690 Len=0 MSS=65495 SACK_PERM=1 TSval=2804772477 TSecr=0 WS=128","127.0.0.1"
"261","TCP","74","5.020205246","127.0.0.1","42002  >  37094 [SYN, ACK] Seq=0 Ack=1 Win=43690 Len=0 MSS=65495 SACK_PERM=1 TSval=2804772477 TSecr=2804772477 WS=128","127.0.0.1"
"262","TCP","66","5.020218390","127.0.0.1","37094  >  42002 [ACK] Seq=1 Ack=1 Win=43776 Len=0 TSval=2804772477 TSecr=2804772477","127.0.0.1"
"263","TCP","1066","5.020241315","127.0.0.1","37094  >  42002 [PSH, ACK] Seq=1 Ack=1 Win=43776 Len=1000 TSval=2804772477 TSecr=2804772477","127.0.0.1"
"264","TCP","66","5.020249916","127.0.0.1","42002  >  37094 [ACK] Seq=1 Ack=1001 Win=45696 Len=0 TSval=2804772477 TSecr=2804772477","127.0.0.1"
